Image,Id
b713fe5bf.jpg,w_f3b2948 new_whale w_d73c048 w_e1ffbe2 w_6f9f759
b714f67b8.jpg,w_5a49beb new_whale w_acbedef w_31233f8 w_89f6097
b71e2a246.jpg,w_72f5c64 new_whale w_74c924a w_de657c1 w_e2a09d4
b7220b193.jpg,new_whale w_fbc7895 w_d10cf66 w_47d86e8 w_fbf7d73
b72eec424.jpg,w_8d0a2a2 new_whale w_003bae6 w_0bdc5d5 w_9cc2c36
b7315611d.jpg,new_whale w_b2bc0c9 w_5482351 w_6cfa650 w_953b7b2
b73949ea6.jpg,w_022b708 w_d405854 new_whale w_772845b w_e6d5621
b744cc54d.jpg,new_whale w_396c12b w_e8e08e6 w_d97c490 w_b57a7be
b74e82291.jpg,w_8d9af77 new_whale w_5510cf3 w_025911c w_91b678a
b750b491e.jpg,w_ce8aa12 new_whale w_f1b6eea w_f8b4ea9 w_1b6f6dc
b75883f99.jpg,w_87b0e69 new_whale w_63f5740 w_715b1b5 w_07e0c3c
b75ce144d.jpg,w_653099f new_whale w_ab2ac77 w_0fdf741 w_eb13108
b75e3212c.jpg,new_whale w_8b813a5 w_f35e494 w_5966e55 w_5157259
b76c39822.jpg,w_98f2705 new_whale w_d907b6c w_70a2a2f w_29cde7c
b76d6a2db.jpg,w_ea902fb new_whale w_21b3c7e w_98f2705 w_210caac
b7752274d.jpg,w_c01c1f4 w_9be308e new_whale w_218fe4a w_990921b
b7836d89b.jpg,w_50e8d58 new_whale w_c3d896a w_34d7623 w_05d65b9
b7881de18.jpg,w_3879fa0 new_whale w_b2bc0c9 w_317c071 w_6cfa650
b79568329.jpg,w_28c330c w_f1b6eea new_whale w_b2bc537 w_ecd734e
b7a783262.jpg,w_faf5287 new_whale w_ac51301 w_07d4b0a w_a8b34a0
b7a82d57c.jpg,w_a053ed9 w_7547b9a new_whale w_0f5666b w_fe15413
b7aa709b7.jpg,w_3278209 new_whale w_89f6097 w_8443156 w_b60e861
b7afb75d1.jpg,new_whale w_dc97eed w_22f2567 w_0886321 w_e51c0e9
b7c279c8b.jpg,w_e918d4c new_whale w_3ff114c w_a3d2008 w_cb50f6e
b7d3f8d73.jpg,new_whale w_d2facb4 w_e145c7a w_7e0659e w_bc6171b
b7da52597.jpg,new_whale w_9340ca3 w_a190a88 w_6555d06 w_8e3a722
b7dd71a37.jpg,w_85a2285 w_8f4d879 new_whale w_f1b6eea w_7d8c37c
b7e2f6662.jpg,w_971d191 new_whale w_d236b51 w_5946cd1 w_d066c0a
b7e459fd9.jpg,w_b6ad668 new_whale w_b9d5945 w_b708e98 w_6172f4a
b7e4c350c.jpg,new_whale w_a113b33 w_a473267 w_59052ad w_b938e96
b7f22b386.jpg,w_3511bc7 new_whale w_97ba78a w_2b49489 w_705e466
b7f522539.jpg,w_1d532b4 new_whale w_446a02d w_1f0cf0a w_c2a1bc4
b7faf0106.jpg,w_58d8bbd new_whale w_a8b0ec1 w_9544084 w_0da34d3
b802d1d13.jpg,new_whale w_c9cf75d w_6dbfd7a w_e2b0292 w_242fb46
b8045cf20.jpg,w_f06439d new_whale w_7918564 w_e04d084 w_f59bb62
b80ddd463.jpg,w_470be90 w_4c07458 new_whale w_6658081 w_23a388d
b81f10c64.jpg,w_ae6ac74 new_whale w_25085e0 w_d236b51 w_bd18f3c
b82051bad.jpg,w_d066f46 new_whale w_8a35001 w_e5ab551 w_6eb10d2
b82aba32a.jpg,w_e86689c new_whale w_e11afff w_242fb46 w_ddf876d
b82b7b34f.jpg,new_whale w_9b171a8 w_e74475b w_b5e13cd w_371d32d
b8332b91f.jpg,w_22d96e7 new_whale w_1ecca2d w_df6b050 w_ddb62c2
b83a73fb6.jpg,w_37d2f3a new_whale w_ec0e6ed w_88065f2 w_193bf22
b83d3870a.jpg,w_f6e5311 new_whale w_a9304b9 w_f314516 w_c5afe0e
b851af780.jpg,w_e52ff99 new_whale w_64404ac w_16df050 w_bb7d9d5
b855302bd.jpg,w_950c471 new_whale w_928ec6c w_22d96e7 w_69b5ace
b855cabc0.jpg,new_whale w_9a1a810 w_53215c6 w_6d8f72e w_27a6304
b857ddfec.jpg,w_5a9abcf new_whale w_bfe77d0 w_394f053 w_2f8de4f
b85867e5b.jpg,w_551165a new_whale w_21b2790 w_08630fd w_27597ff
b865f6461.jpg,w_e86689c new_whale w_fdcaaa8 w_40a8585 w_72f3685
b866eec51.jpg,new_whale w_86f34e8 w_b747aeb w_bece5a4 w_6c886f0
b86bcfb01.jpg,w_6e97ef4 new_whale w_df1f698 w_d494351 w_37e08ff
b86ee5851.jpg,w_a8d89df new_whale w_49ce813 w_45473b9 w_2a7f00f
b87bfeb81.jpg,w_8675aac new_whale w_0ce537a w_7a8ce16 w_05bf34e
b87c3fc27.jpg,w_ec16cc4 new_whale w_d8de44c w_335bdd1 w_7a1c290
b8841481b.jpg,w_05081a8 new_whale w_d01f587 w_9109577 w_4d7df64
b88cff897.jpg,new_whale w_adedd1f w_396c12b w_4eb6bcc w_5fcf350
b8aabe0a8.jpg,w_564a34b new_whale w_7e579dd w_a6a1bea w_26c0ffd
b8ac72534.jpg,w_ae19ff0 new_whale w_34ecf36 w_12e8dc7 w_bc7de9f
b8ae0dd22.jpg,w_f61b957 new_whale w_26c0ffd w_8a6a8d5 w_14b1427
b8af3442b.jpg,w_df86a42 w_1afed1e new_whale w_26c0ffd w_a32ff7f
b8b23793f.jpg,w_8507818 new_whale w_9a5bb2d w_80124ae w_f0fe284
b8ba4cc2a.jpg,w_5821157 w_ae6ac74 new_whale w_b0ffd3b w_454f511
b8cf925bf.jpg,new_whale w_f2dd08f w_b3197c6 w_1995d15 w_89f6097
b8d9bc71d.jpg,new_whale w_795a6b8 w_bfe77d0 w_f793b1f w_0887d9b
b8eddaa39.jpg,new_whale w_f0663e5 w_4a8a4c9 w_243b654 w_85b252c
b8ee43e3b.jpg,w_d066f46 new_whale w_cf1e889 w_e74475b w_29af733
b8f950771.jpg,w_4a8a4c9 new_whale w_f1b6eea w_3bb142c w_c4862bb
b8ffcad73.jpg,new_whale w_0a155b9 w_0b398b2 w_6e7763b w_234713b
b90c86eac.jpg,new_whale w_94f41dc w_f94fc92 w_715b1b5 w_358c519
b90dbfd40.jpg,new_whale w_68eaf36 w_3b71107 w_df1f698 w_966b510
b91284206.jpg,w_361a865 w_b495218 new_whale w_c8e2df4 w_29af733
b92adfa5d.jpg,w_68eaf36 new_whale w_f546938 w_1719d81 w_c3c0d22
b9498d4a3.jpg,w_fb02461 new_whale w_286d2cc w_80b474e w_3a34d6f
b96a2b179.jpg,w_990921b new_whale w_df1f698 w_4c206e7 w_d494351
b96ac14e1.jpg,w_e66ced8 new_whale w_42c1a3c w_0f466a5 w_1f7c696
b97d4ac04.jpg,new_whale w_08d62ee w_86726bc w_0a87ea4 w_dfc200b
b9809a2ad.jpg,w_d8a08f8 w_fd6a3ad new_whale w_1f8c439 w_4fadedd
b994a2b0f.jpg,w_e6325d7 new_whale w_60cf87c w_1c6465a w_6b00c91
b99912697.jpg,w_04d4568 w_8e88f4f w_f1b6eea new_whale w_4dcdda3
b9a322326.jpg,w_bda67e7 new_whale w_4a28f21 w_e6d5621 w_ba0751c
b9a4acb2e.jpg,new_whale w_40a8585 w_b71ac68 w_470be90 w_aeabde9
b9a7bf09a.jpg,new_whale w_ae8982d w_4ea4f59 w_36fdacd w_f0fe284
b9aba5b84.jpg,w_11bd416 new_whale w_8e3a722 w_62c76f3 w_1032fa3
b9cb1c7f5.jpg,new_whale w_193f83c w_98a87a6 w_cc1784d w_3c8b9ea
b9dfc294b.jpg,new_whale w_302799d w_1ff168e w_c7e1b12 w_37bdff9
b9dfdac35.jpg,w_f2d26f2 new_whale w_dd944b7 w_69b5ace w_fdd3687
b9e4723ad.jpg,new_whale w_61e4690 w_72f5c64 w_f2d26f2 w_b0cadc0
b9e4fbc0a.jpg,w_16def42 new_whale w_2e4cb98 w_d97c490 w_9b5109b
b9e8529d8.jpg,w_7c26ef7 new_whale w_f37c434 w_22f46ab w_264c2e1
b9f03b263.jpg,w_a9304b9 new_whale w_c9cf75d w_94e136e w_3c972b3
b9f5fd430.jpg,new_whale w_2597710 w_640a24a w_79843ce w_470be90
ba0558b55.jpg,w_d6aa3f3 new_whale w_c7e1b12 w_8b86b95 w_5485228
ba099d88a.jpg,w_c55c51d new_whale w_0a155b9 w_1b0db58 w_1efbb8e
ba0fad4a6.jpg,new_whale w_939423d w_7cc7ec6 w_3ec7fa2 w_8e88f4f
ba10461d8.jpg,w_cfae8d8 new_whale w_68eaf36 w_4f6b509 w_d1207d9
ba11972c3.jpg,new_whale w_e21b629 w_2f8de4f w_9c506f6 w_59052ad
ba156c06c.jpg,w_dc651ad new_whale w_f86b16b w_4b815d3 w_6bab2bd
ba1b38756.jpg,w_b5e6c9c new_whale w_7e0659e w_5157259 w_cf8cd88
ba1c12b8a.jpg,w_003bae6 new_whale w_17a3a21 w_1c6465a w_7e1ce0a
ba2155ce5.jpg,w_f77e282 w_789c969 new_whale w_a34d26b w_bc62c27
ba250a21e.jpg,w_8a6a8d5 w_88e4537 new_whale w_f056e82 w_f61b957
ba26eebaf.jpg,w_32da935 new_whale w_e4a9205 w_ac51301 w_99b7ba2
ba297763d.jpg,w_817d53c new_whale w_8c8f8b6 w_1f6de0b w_335bdd1
ba29dfaf2.jpg,new_whale w_5a90eff w_05b4b0c w_6f9f759 w_09c8a69
ba2bf0197.jpg,w_14ece76 w_8f38839 new_whale w_8e3a722 w_1d9592f
ba2cbe0e6.jpg,new_whale w_bef54e9 w_4a9436a w_270f505 w_b403feb
ba30cc7d0.jpg,w_1efbb8e new_whale w_71d5ba2 w_8a06b46 w_5d426b6
ba3154602.jpg,w_8ad2534 w_98f2705 w_e022d1b new_whale w_5d6ba39
ba3f3e164.jpg,w_4460861 new_whale w_59052ad w_68eaf36 w_23e1d57
ba436d574.jpg,w_9eb2d2a new_whale w_ac51301 w_2211e6d w_81eb375
ba63b7efe.jpg,w_bdded04 new_whale w_714f89f w_ac835f9 w_c734fa4
ba690ec64.jpg,w_fd6a3ad w_fccccec new_whale w_e70a3d0 w_bb2c919
ba70fccc4.jpg,w_16df050 new_whale w_37d2f3a w_04d4568 w_8e88f4f
ba7167678.jpg,w_186d294 new_whale w_700ebb4 w_48d22a3 w_2f1488c
ba767954f.jpg,new_whale w_f648d33 w_e52ff99 w_b99f945 w_5cf4727
ba7772e9a.jpg,new_whale w_334c489 w_25085e0 w_0a87ea4 w_72c56cc
ba7773132.jpg,new_whale w_eec4e46 w_d284505 w_a9304b9 w_1a7ccaf
ba7a23368.jpg,w_e1c5b57 new_whale w_232f528 w_84308d6 w_31154fa
ba89e6a6a.jpg,new_whale w_ae6ac74 w_8b1f4be w_08d62ee w_6afdf63
ba8c64486.jpg,new_whale w_60ce6fc w_4c62681 w_a3181a0 w_6822dbc
ba97f7153.jpg,w_fbfe96b new_whale w_f0eddab w_cb476e2 w_877de07
baa611734.jpg,w_689cfe2 w_23ce00e new_whale w_4cf5e29 w_45246db
baa921484.jpg,w_714f89f new_whale w_03670aa w_7efe670 w_7d44896
baaa3973b.jpg,w_4e63f7a new_whale w_d066c0a w_d007a72 w_e922901
baacab6cc.jpg,new_whale w_4344f5e w_32838db w_780c931 w_990921b
bab689ff0.jpg,w_90fb95b new_whale w_659bdb8 w_8b8dca8 w_f765256
babd8c446.jpg,w_2b50adf new_whale w_5cc76f8 w_b3cde16 w_02d138d
bac131aed.jpg,w_470be90 new_whale w_f70c302 w_e6dfc39 w_6dbfd7a
bac27232d.jpg,w_95f78f6 new_whale w_938701c w_8b647d4 w_4e00a18
bad951578.jpg,w_b70c09f new_whale w_08d62ee w_5ae026a w_84dadae
badb59834.jpg,w_e4d326a new_whale w_ccc26ea w_7c1435e w_46ccc6f
badcc1376.jpg,w_89f6097 new_whale w_bdded04 w_bd18f3c w_b8b8383
baf408496.jpg,w_32da935 new_whale w_2623921 w_53feb91 w_c720f04
baf9e962b.jpg,new_whale w_69b5ace w_0e0b65c w_d8a08f8 w_22d96e7
bb081653b.jpg,w_0135f5f new_whale w_939423d w_97ba78a w_659bdb8
bb221f4c8.jpg,new_whale w_480d478 w_b2bc537 w_59052ad w_68eaf36
bb31d1ecc.jpg,w_2137c6f w_4bf625b new_whale w_a7067d1 w_c0f1e04
bb4167184.jpg,new_whale w_26a55ed w_8f1069a w_a6eaf8d w_b5e13cd
bb46166dc.jpg,w_6df47c6 new_whale w_5a2634c w_bcf69e9 w_9fe60cd
bb4c09c33.jpg,w_1baf8df new_whale w_cd4cb49 w_ece94e8 w_1032fa3
bb5147830.jpg,w_42e0e40 new_whale w_79843ce w_b495218 w_d0bf381
bb52704fc.jpg,w_d3b1733 new_whale w_74f384b w_e71f9c7 w_45473b9
bb53d003f.jpg,w_74c924a new_whale w_70fc054 w_1f7c696 w_dd88965
bb5589bc5.jpg,w_c4232a3 new_whale w_d22e12a w_9732911 w_396c12b
bb5980e46.jpg,w_eeea781 new_whale w_7e1ce0a w_67f670e w_659bdb8
bb5f598e7.jpg,w_14b1427 w_8b86b95 new_whale w_df1f698 w_3b71107
bb6008403.jpg,w_2d1592c new_whale w_6525e6b w_80a59e6 w_2e374c0
bb6023d80.jpg,w_8c8f8b6 w_953b7b2 w_41301dd new_whale w_a70b90b
bb6c3f5d5.jpg,w_5ae026a new_whale w_c4862bb w_8340caf w_99e43ae
bb73cb5c3.jpg,new_whale w_4dac709 w_e5c28c9 w_be4f189 w_b7babc0
bb77aafc4.jpg,new_whale w_ef83760 w_7e2eb3d w_8eae2c3 w_a165159
bb7b07e3d.jpg,w_2652d72 new_whale w_d6d89ed w_cf8ce56 w_4214909
bb7fc67fa.jpg,w_691f2f6 new_whale w_0fdf741 w_ab7c369 w_939423d
bb83f28fe.jpg,w_fa2ec89 new_whale w_88aca21 w_e1ffbe2 w_4b5ade3
bb862c684.jpg,w_decafbd new_whale w_551f361 w_4369be0 w_8443156
bb9875158.jpg,w_c2a1bc4 new_whale w_8cbe62a w_f765256 w_ac910d6
bb99151d0.jpg,w_b9e5911 new_whale w_68eaf36 w_6525e6b w_b3cde16
bba388f85.jpg,new_whale w_3309cbd w_9b25161 w_5e8e218 w_3dc1e42
bba5883d7.jpg,w_a059841 new_whale w_f9a9dec w_0135f5f w_2d1592c
bbae24d44.jpg,w_fa2ec89 new_whale w_2d1592c w_b938e96 w_fd3e556
bbb8886b1.jpg,w_b003eb0 w_8c8f8b6 new_whale w_2362d7f w_491b2e5
bbbc50872.jpg,w_ae19ff0 new_whale w_57db059 w_f381082 w_4441671
bbbdea217.jpg,w_e897a60 new_whale w_7f04b8b w_f2075ef w_ecd734e
bbbf61a2b.jpg,w_5e8e218 new_whale w_ae32f8b w_1de6148 w_fbc7895
bbbf7d7b6.jpg,w_3815890 new_whale w_6822dbc w_d17b0c5 w_ab7c369
bbc2abda4.jpg,w_4bf625b w_518a722 new_whale w_91037a7 w_b93105d
bbc51da3b.jpg,new_whale w_d602efb w_aa32f70 w_aa9f4b2 w_62c78f3
bbc56ac39.jpg,new_whale w_715c34b w_90c9763 w_f128a4d w_03670aa
bbe839e0b.jpg,w_69b5ace new_whale w_22d96e7 w_aa45520 w_927f345
bbf55f5ba.jpg,w_dee1053 new_whale w_c1715f5 w_4801beb w_9a1a810
bc03470dc.jpg,w_b8a7ee7 new_whale w_1ff111d w_9297b97 w_d0528f6
bc05329c4.jpg,w_4135cb8 new_whale w_22d96e7 w_6aab519 w_7efe670
bc06fbaa7.jpg,new_whale w_b9d5945 w_e5978cf w_773a8fd w_3334d3f
bc10f47d7.jpg,w_6cfa650 new_whale w_eb3f1ff w_28589bc w_3eae264
bc234f06d.jpg,w_56c9d4e new_whale w_d0bfef3 w_520731e w_4951cb9
bc2726e60.jpg,new_whale w_f829227 w_bda67e7 w_a8276b4 w_ddf876d
bc2b3d936.jpg,new_whale w_90fb95b w_754cc34 w_b3cc7b3 w_e2b0292
bc2e6cedf.jpg,w_51fc1fc w_98f2705 w_a2158b8 new_whale w_f94fc92
bc2edbd67.jpg,w_0c59853 new_whale w_3f78360 w_5597026 w_1c6465a
bc36b4a99.jpg,w_4661aac new_whale w_993320b w_89773ab w_b5e6c9c
bc3795489.jpg,w_2ff0834 new_whale w_84308d6 w_4f9c015 w_32da935
bc40765a6.jpg,w_5b227ec new_whale w_9714922 w_1f429ff w_90abfeb
bc48e967e.jpg,new_whale w_d97c490 w_8431ae8 w_3d56b7c w_95f78f6
bc4c3b21b.jpg,new_whale w_564a34b w_927f345 w_2b4b82e w_2ff0834
bc577ba90.jpg,w_da5b8fe new_whale w_68c4ecf w_6525e6b w_e2c24d2
bc5f7a4c6.jpg,new_whale w_df1f698 w_535448f w_e25b062 w_7e579dd
bc605917b.jpg,w_9ba4a9a new_whale w_ab2ac77 w_3eae264 w_fbc7895
bc6259f19.jpg,new_whale w_13ffdcf w_81d1ff9 w_d007a72 w_ab41d9b
bc6771f0a.jpg,w_d15dd0b w_25f1a4e new_whale w_6d59878 w_64404ac
bc6e92acd.jpg,new_whale w_0c69117 w_4dfeafc w_d3332dc w_2d0cfc1
bc70de866.jpg,w_6dbfd7a new_whale w_234713b w_6822dbc w_564a34b
bc766ae57.jpg,w_f6c5343 w_691f2f6 new_whale w_022b708 w_939423d
bc85b9349.jpg,w_f9a9dec new_whale w_cc57ddc w_6332313 w_0637181
bc96564b0.jpg,w_5b463cf w_75ec7c1 new_whale w_22d96e7 w_9b89c88
bcb232be6.jpg,w_446a02d new_whale w_327175f w_40a8585 w_de657c1
bcba63426.jpg,w_f5bf6df new_whale w_16dfac7 w_f61b957 w_e3956f5
bcbe02a27.jpg,w_9cf0388 new_whale w_7648ac1 w_5d426b6 w_17a3a21
bcc947fe7.jpg,w_ac51301 w_9eb2d2a new_whale w_32da935 w_e4a9205
bcca40612.jpg,w_88065f2 w_89f521e new_whale w_0fdf741 w_9032a74
bccd961af.jpg,new_whale w_242fb46 w_dcee281 w_f70c302 w_a2a40d2
bce29064e.jpg,w_bc7de9f new_whale w_af367c3 w_4441671 w_0da34d3
bce907bdc.jpg,w_efbdcbc new_whale w_cb88c1b w_7ba6d48 w_733f661
bcf0e265b.jpg,w_832917d new_whale w_1920193 w_3e4a1a5 w_81d1ff9
bcf625594.jpg,w_be78b58 new_whale w_2b65b34 w_1a70f3a w_a7e3d55
bd0479d5b.jpg,w_9ba4a9a w_c865cfd new_whale w_16b5050 w_6b2ecc8
bd18bc906.jpg,w_4369be0 new_whale w_b9d5945 w_98a87a6 w_7547b9a
bd1e67a68.jpg,new_whale w_470be90 w_e1ffbe2 w_e5c28c9 w_08630fd
bd39c1887.jpg,w_b3cde16 new_whale w_07768b0 w_edf0164 w_a3b1a48
bd53b06d1.jpg,w_4dac709 w_b2bc0c9 w_fc230fd new_whale w_53276a1
bd5a817bc.jpg,w_2f8de4f w_04acf95 new_whale w_13c1b55 w_c262606
bd704534b.jpg,w_5c85850 new_whale w_0887d9b w_d8b4a5d w_922e139
bd74c64e0.jpg,w_accb0cb new_whale w_f71de1c w_ab7c369 w_56c9d4e
bd7cefa8d.jpg,w_0abdaf4 new_whale w_29a8580 w_a059841 w_c25d2d1
bd7e437f8.jpg,w_990921b new_whale w_4ff2f4a w_25183b8 w_e21b629
bd89c38c4.jpg,w_08630fd new_whale w_b9d5945 w_13aa123 w_2c3f556
bd8c9e419.jpg,w_2d99567 new_whale w_07019f4 w_83869d3 w_037b23f
bd9a84fd4.jpg,new_whale w_264c2e1 w_9b5109b w_13edc47 w_4d06559
bd9bd3197.jpg,new_whale w_08630fd w_54e7b40 w_e1ffbe2 w_b7babc0
bd9f115ad.jpg,new_whale w_711765a w_c6a96e1 w_6dce358 w_92eaff4
bda06bd79.jpg,w_93fddcb new_whale w_14ece76 w_2009f8b w_fa4034b
bda0711db.jpg,w_4c62681 new_whale w_e1ffbe2 w_3f5c708 w_584e1dc
bda37ff9a.jpg,new_whale w_a3d2008 w_bfed9c6 w_22d96e7 w_45246db
bdbd18311.jpg,new_whale w_0bc1de9 w_6bab2bd w_bc28a13 w_d210085
bdc71d45a.jpg,w_74c924a new_whale w_1be76f5 w_0718183 w_9353e7c
bdc77d7e1.jpg,w_c2397a4 new_whale w_f10d0eb w_71df35a w_7677b27
bdcfe13dd.jpg,w_dc651ad new_whale w_b21cfe4 w_0f56fb2 w_a6703dd
bdd108816.jpg,new_whale w_1104cca w_4be6d99 w_4d06559 w_7250aef
bdd562cb1.jpg,w_4b5ade3 new_whale w_966b510 w_c1d2fbe w_e07b79f
bdd6b7481.jpg,w_36fdacd new_whale w_107b98e w_ab2ac77 w_d1207d9
bdd944df5.jpg,w_a9822dd new_whale w_b23555d w_ec0e6ed w_b70c09f
bde054dea.jpg,w_b67fcb9 new_whale w_14330a0 w_394f053 w_45c5396
bdf37eecb.jpg,new_whale w_15805cd w_0db234e w_b012783 w_9cf0388
bdf744404.jpg,new_whale w_954fec8 w_745ee82 w_84308d6 w_d7998d1
bdf87d8c8.jpg,new_whale w_350bfd5 w_c5c01af w_036bc54 w_2d6bb89
bdfdad652.jpg,w_2b388fe w_5645ed1 new_whale w_8a6a8d5 w_20df2c5
be0523c2f.jpg,w_40be8d6 new_whale w_b8a7ee7 w_6ebfe7b w_eeea781
be1024399.jpg,new_whale w_4bf625b w_7d44896 w_90c9763 w_c85ff1e
be220efc9.jpg,new_whale w_efbdcbc w_b9ee9d1 w_d2facb4 w_2009f8b
be22d0a88.jpg,w_636b9a8 new_whale w_f381082 w_88e4cbf w_8cee3d3
be27e2f1b.jpg,w_4130233 new_whale w_98a87a6 w_1be76f5 w_3c8f7da
be294a37e.jpg,new_whale w_c875e45 w_8a6a8d5 w_88e4537 w_f61b957
be31bf08c.jpg,w_51fc1fc new_whale w_2137c6f w_591a2c5 w_d066f46
be3983957.jpg,new_whale w_57acd97 w_5b40032 w_944ac4f w_7d4d7cd
be3a4916b.jpg,new_whale w_8507818 w_c650f39 w_5665c80 w_19f507e
be3e7d28a.jpg,w_e1ffbe2 new_whale w_98d094e w_f6524e1 w_f0eddab
be4ac2193.jpg,w_fc83ab4 w_43f0465 new_whale w_c865cfd w_7571b52
be4c9d458.jpg,w_06d2e72 new_whale w_2f74ff3 w_817d53c w_4369be0
be50af184.jpg,w_61b9586 w_3815890 new_whale w_b311fb6 w_80124ae
be537f377.jpg,w_dfc200b new_whale w_89f6097 w_4cc050e w_4bbd0fd
be6859b88.jpg,w_75cebcf new_whale w_c5e1472 w_11bd416 w_9bebed8
be6b61ee4.jpg,w_d892cd9 new_whale w_aee6701 w_be776c7 w_04003e9
be711a507.jpg,w_64cddcd w_4523384 new_whale w_2211e6d w_aec2b6d
be76e5f8f.jpg,new_whale w_a053ed9 w_e73d9a5 w_d0bfef3 w_9d29561
be7d80785.jpg,w_6579856 w_e52ff99 new_whale w_5821157 w_2db0644
be809113a.jpg,new_whale w_cbb15d2 w_4ff2f4a w_443afc0 w_242fb46
be80f3c0b.jpg,new_whale w_1ebcda9 w_aabdf8c w_4441671 w_d3332dc
be8551936.jpg,new_whale w_c073f96 w_e05c1a2 w_cf5335b w_cb50f6e
be9004d7b.jpg,w_32da935 new_whale w_b7b1472 w_583aba1 w_03e3e5e
be9af0799.jpg,new_whale w_cb593df w_ecb61a0 w_fd3e556 w_c01c1f4
beaa492cb.jpg,w_4e275ed w_bf960fa w_f2d26f2 new_whale w_decafbd
beb18d172.jpg,w_ef83760 w_98f2705 new_whale w_4bf625b w_f0fe284
bec1b14cc.jpg,w_560305a new_whale w_dfbf100 w_cb50f6e w_bc65e7f
bec2f30d5.jpg,new_whale w_4c62681 w_20dfb69 w_9be7408 w_40be8d6
bec66f23c.jpg,w_445a265 new_whale w_567502c w_c7e1b12 w_68eaf36
bec716ba6.jpg,w_bd26110 new_whale w_08630fd w_edf43c1 w_47aa042
bee31cd22.jpg,new_whale w_e8ab3c8 w_fccac74 w_8a6a8d5 w_88e4537
bef453e65.jpg,w_8f1069a new_whale w_7c60e77 w_8a1b71c w_025911c
bef7a8545.jpg,w_a68bac6 new_whale w_4a8a4c9 w_243b654 w_5ae026a
bf064abdc.jpg,new_whale w_3b71107 w_aa0dacc w_ecb61a0 w_f8746c3
bf085c508.jpg,w_08630fd new_whale w_262c32f w_7ff9682 w_b938e96
bf0ac4a74.jpg,w_bfcad53 new_whale w_0cbf1b3 w_f2d26f2 w_396c12b
bf197172b.jpg,new_whale w_eaa5dbb w_9227ca2 w_0bbc3cb w_2497490
bf3ff3879.jpg,w_a79e00d new_whale w_13aa123 w_b4fe6b0 w_817d53c
bf42129d9.jpg,w_fa2ec89 new_whale w_43f0465 w_02c7e9d w_e71f9c7
bf42cdb63.jpg,w_2b39f31 new_whale w_e09baaa w_4fdb4c1 w_25b2b3d
bf5c08752.jpg,w_4f9c015 new_whale w_eeea781 w_6525e6b w_c01b2e9
bf681632d.jpg,w_0a87ea4 new_whale w_abf193d w_7cc7ec6 w_be5615a
bf82a2a2e.jpg,new_whale w_c6b4d61 w_fd906cc w_08630fd w_59052ad
bf830ad03.jpg,w_ab2ac77 new_whale w_0c69117 w_af7a56f w_5e8e218
bf85a70d6.jpg,w_0bfdcca new_whale w_cf8cd88 w_e21b629 w_0a87ea4
bf947561c.jpg,w_df1f698 new_whale w_f953704 w_7d458aa w_16a13bb
bf9571612.jpg,new_whale w_db68456 w_26c0ffd w_6fe3566 w_11bd416
bf986b21f.jpg,new_whale w_1d0830e w_234713b w_4bf625b w_f3addb7
bf9c97eea.jpg,w_00904a7 new_whale w_748290a w_e014c37 w_e21819b
bfac59af5.jpg,w_4e626be new_whale w_cc1784d w_36bbd71 w_037b23f
bfb04b85b.jpg,new_whale w_c4862bb w_3bb142c w_eeea781 w_8431ae8
bfb9ef767.jpg,w_009c9c5 w_2034344 w_f829227 new_whale w_4214909
bfc8f5d7b.jpg,w_03e3e5e w_f056e82 new_whale w_7ad1459 w_0eab54f
bfd30de86.jpg,w_e4d326a new_whale w_70fc054 w_fd6a3ad w_d405854
bfd521ee0.jpg,new_whale w_aeabde9 w_db68456 w_4c62681 w_7d6527e
bfe60469f.jpg,new_whale w_eec42d0 w_84f9ab0 w_81d4bd6 w_3aa8e97
bfe7ec5ab.jpg,new_whale w_e906edd w_5c2bc89 w_8d99f99 w_cbaa911
bfe8858e1.jpg,w_b99f945 new_whale w_0da34d3 w_96c6613 w_d3332dc
bfe8b6c2b.jpg,new_whale w_71df35a w_5b40032 w_7e0659e w_7a8ce16
bfed3fbfb.jpg,new_whale w_4dcdda3 w_6ca173f w_fb02461 w_b7cf3f5
bff0f1a93.jpg,w_fbfe96b new_whale w_6172f4a w_59915b1 w_118fad5
c00b5af3e.jpg,w_1d0830e new_whale w_19fb122 w_234713b w_3eae264
c0167e10a.jpg,w_bc285a6 new_whale w_343f088 w_b950c88 w_e5ab551
c01e1d479.jpg,w_68eaf36 new_whale w_2b4b82e w_f546938 w_4ff2f4a
c025fed82.jpg,w_358c519 new_whale w_fccac74 w_1032fa3 w_5b227ec
c02d5e7b0.jpg,w_acbedef new_whale w_34941d8 w_4ff2f4a w_7648ac1
c031b3ca0.jpg,w_6bab2bd new_whale w_f1b6eea w_335bdd1 w_2f67f0a
c0381fc3a.jpg,w_bda67e7 new_whale w_fbfe96b w_7830b52 w_59915b1
c03dedb0d.jpg,new_whale w_2d7c2dd w_659bdb8 w_a32ff7f w_f8511e9
c04e10ecd.jpg,w_f48451c new_whale w_972e51e w_d223b2e w_25085e0
c0597bf08.jpg,w_9ad3618 new_whale w_3de579a w_f629616 w_36b8101
c05c163f3.jpg,w_009c9c5 new_whale w_ce4d993 w_928ec6c w_700ebb4
c0607c316.jpg,w_22d96e7 new_whale w_c190aa8 w_d6d89ed w_fa84489
c06c089b2.jpg,w_c0d11da w_e8c5ff0 new_whale w_45e277d w_2211e6d
c085dd899.jpg,w_6b25530 new_whale w_89f6097 w_93d7617 w_8443156
c08d84b82.jpg,w_45473b9 new_whale w_d68c135 w_48d22a3 w_94da1e2
c0a114e53.jpg,w_dc651ad new_whale w_010f858 w_f2075ef w_591a2c5
c0a58041e.jpg,w_6332313 w_5591cd8 new_whale w_535448f w_88b981e
c0a58c1b4.jpg,w_43f0465 new_whale w_f765256 w_6cfa650 w_1666216
c0aa9e38e.jpg,w_4441671 new_whale w_650f587 w_0b1e4a6 w_1e283bb
c0b2ecf1d.jpg,w_e3956f5 new_whale w_396c12b w_46796cc w_b7b0ad7
c0b378682.jpg,w_b99f945 new_whale w_1fe6c6e w_dd08014 w_5e8e218
c0bbbf064.jpg,w_98d094e new_whale w_0cfae04 w_8a6a8d5 w_8092f18
c0bce1b53.jpg,w_efa100e new_whale w_2211e6d w_0189b6d w_72019ec
c0bd3b98c.jpg,new_whale w_927f345 w_2211e6d w_37e08ff w_efa100e
c0c6d643f.jpg,new_whale w_ab10c70 w_8e3a722 w_96c35cc w_81f8d47
c0c9ea298.jpg,new_whale w_803ad0d w_3499014 w_9227ca2 w_5510cf3
c0cd9eeca.jpg,w_343f088 new_whale w_2d99567 w_50f9d24 w_102e715
c0dc8c424.jpg,w_9c506f6 new_whale w_df1f698 w_555dcb4 w_14b1427
c0ea7a383.jpg,w_67f670e new_whale w_20dfb69 w_6906eed w_e819d10
c0eafea36.jpg,w_32eac70 new_whale w_0fdf741 w_20950a9 w_a2f8488
c0ef727fb.jpg,new_whale w_ec16cc4 w_9b89c88 w_76ad1d2 w_928ec6c
c10383c86.jpg,w_4167fbb w_84f9ab0 new_whale w_68eaf36 w_686bbcb
c104744b9.jpg,w_75cebcf new_whale w_14ece76 w_9b1d3d5 w_84714f4
c1048b3f4.jpg,w_8fb247e w_a88c767 new_whale w_bb56867 w_ce72e73
c10aa0ed6.jpg,new_whale w_d6d89ed w_d6f0be4 w_9af432a w_9ddb645
c117b794d.jpg,w_8ca7f37 new_whale w_2df85e7 w_59915b1 w_7d6527e
c11ecabeb.jpg,w_bfcad53 new_whale w_05b4b0c w_ae393cd w_030c8b0
c13dc7ac2.jpg,w_b5cf062 w_80729eb new_whale w_492d9c5 w_112d2f8
c13e46298.jpg,new_whale w_1419d90 w_0a8d318 w_8b8ef96 w_5ae026a
c1473d059.jpg,w_ea902fb new_whale w_16a13bb w_62e5aa0 w_1c6465a
c148421d8.jpg,w_46796cc new_whale w_e3956f5 w_df86a42 w_396c12b
c1606ad8d.jpg,w_f3a12bc new_whale w_9c506f6 w_80b474e w_e906edd
c1643ef68.jpg,new_whale w_470be90 w_3da0eae w_568e9fd w_dd944b7
c16aae45f.jpg,w_cf5335b new_whale w_0745b0e w_b7babc0 w_8b813a5
c1754620d.jpg,w_cfdd1c0 w_c0b01ea new_whale w_317ae6c w_b495218
c17786f3f.jpg,new_whale w_f59bb62 w_e5ab551 w_11d8c70 w_d066f46
c198ac796.jpg,w_7547b9a w_c190aa8 new_whale w_872f131 w_ec16cc4
c19dbac61.jpg,w_579e5f0 new_whale w_c8d5ad5 w_23a388d w_6b1d160
c1a9a1a6b.jpg,new_whale w_8a1b71c w_e022d1b w_dcee281 w_17b0d3a
c1b1eb7cf.jpg,w_f70c302 new_whale w_4bf625b w_e52ff99 w_e50e9f9
c1ba2f277.jpg,w_f953704 new_whale w_fbfe96b w_16a13bb w_c183657
c1bcb36f7.jpg,w_eaa4d20 new_whale w_73d6671 w_384e3b2 w_0a87ea4
c1c2438b7.jpg,new_whale w_5ff2049 w_88b3466 w_9d86594 w_6cfa650
c1c5a0a97.jpg,w_22d96e7 new_whale w_21b3c7e w_d8a08f8 w_553d1ef
c1c6f669e.jpg,w_e2c24d2 new_whale w_73bfe11 w_0749e87 w_2623921
c1ca9023e.jpg,new_whale w_0ef790d w_a190a88 w_b5c3634 w_5d438a9
c1cc71317.jpg,new_whale w_ef30316 w_78ab4d4 w_d72771c w_7ba6d48
c1d4b58a1.jpg,w_69bb761 new_whale w_e70a3d0 w_e1c5b57 w_5d35047
c1e0c3098.jpg,w_6e0a45b new_whale w_456646a w_26c0ffd w_8f1069a
c1e7d19e3.jpg,new_whale w_b4396ae w_472b51c w_ae19ff0 w_036bc54
c1edbe055.jpg,w_b99f945 new_whale w_68ed1f9 w_8f0c6ed w_274397d
c1f48283c.jpg,w_da40b39 w_b403feb new_whale w_c2c20eb w_92c4ea5
c1f8f9e7f.jpg,w_0a8d318 new_whale w_76a45de w_dea042e w_7e0659e
c1fec8ca9.jpg,new_whale w_7e0659e w_86726bc w_ba9804a w_3904b99
c1ffc3d30.jpg,w_0a155b9 new_whale w_7c77c5c w_aa32f70 w_7cc2687
c2039f683.jpg,w_700ebb4 w_518a722 new_whale w_2645f4d w_d01f587
c20946927.jpg,w_ca66b79 new_whale w_aabdf8c w_217fc01 w_c01c1f4
c20d4ee0c.jpg,w_958b730 new_whale w_760c469 w_5e8e218 w_9bedea6
c238cbe88.jpg,w_4ff2f4a new_whale w_75f6ffa w_090c801 w_e2b0292
c24d6174a.jpg,w_2009f8b new_whale w_12e8dc7 w_ac910d6 w_40a8585
c24dad592.jpg,w_fd6a3ad new_whale w_da011a1 w_85d9229 w_16b5050
c25715ee7.jpg,w_d573a68 new_whale w_e06d673 w_066ddc5 w_bde0cd0
c25834953.jpg,new_whale w_cb50f6e w_194bea2 w_25085e0 w_fbfe96b
c26e92a03.jpg,new_whale w_bff3c3b w_dc651ad w_9e33316 w_e1ffbe2
c26ed66bf.jpg,w_80124ae new_whale w_abfdd10 w_4eb6bcc w_05d65b9
c26fa8510.jpg,w_bc285a6 new_whale w_e11afff w_76065ea w_1ca7433
c27702280.jpg,w_065ee1b w_f5fcb45 new_whale w_c62ac72 w_c1b34d2
c2790e7c9.jpg,new_whale w_3c629a2 w_accb0cb w_1f7c696 w_e66ced8
c27ce139c.jpg,w_1baf8df new_whale w_dea40e2 w_a190a88 w_88bb921
c27e4452e.jpg,w_ea2d2f9 new_whale w_b1b2f0f w_b3e445e w_5d1b1a7
c2917a5f0.jpg,new_whale w_abc5af2 w_8ca7f37 w_463f219 w_62fc862
c297be4b5.jpg,w_2df37cc new_whale w_9fe60cd w_7d44896 w_d8de44c
c29bcb7fd.jpg,w_3bb142c new_whale w_3040ecd w_22d96e7 w_352445a
c29d97ee3.jpg,new_whale w_4d06559 w_0887d9b w_3e4a1a5 w_5c742ec
c29f0a0ac.jpg,new_whale w_acba807 w_502e72f w_966f46a w_ff5fc91
c2a00a179.jpg,w_b4fe6b0 new_whale w_35863c5 w_7cc2687 w_36f2ebb
c2a4d7180.jpg,w_f2d26f2 new_whale w_a589923 w_d5c0064 w_51c003e
c2ace555f.jpg,new_whale w_69b5ace w_ddb62c2 w_22d96e7 w_29a8580
c2b249f5b.jpg,w_37e08ff new_whale w_c2426a1 w_927f345 w_564a34b
c2b68dccc.jpg,w_5ae026a new_whale w_6fe5b8e w_23a388d w_6b1d160
c2b91aae9.jpg,w_f765256 new_whale w_4b5ade3 w_e66ced8 w_bd1c3d5
c2babd6be.jpg,w_a13f1d0 new_whale w_4f9c015 w_06471d5 w_46ccc6f
c2bc91fbf.jpg,w_c2397a4 w_b70c09f new_whale w_80dfb8e w_984bb5c
c2c4f4ad6.jpg,w_c8bbb43 new_whale w_b953028 w_6bab2bd w_f9bffb5
c2c668c71.jpg,w_0745b0e new_whale w_91037a7 w_dd80742 w_9ece6cb
c2caaffd9.jpg,w_ad3a043 w_afcf807 new_whale w_3bf2653 w_7a91862
c2d855a5a.jpg,new_whale w_f24a55c w_9a1a810 w_470be90 w_e52ff99
c2d8bec9e.jpg,w_73d71d2 new_whale w_68eaf36 w_b330c85 w_f74a89e
c2db24907.jpg,w_ea7bc89 w_7d458aa new_whale w_0abdaf4 w_f793b1f
c2dba5ab9.jpg,new_whale w_f48451c w_f24a55c w_05b4b0c w_470be90
c2e5b2db9.jpg,w_a7067d1 new_whale w_4bf625b w_5966e55 w_ecd734e
c2e9bca9b.jpg,w_966b510 w_54ae8bf new_whale w_46c4c49 w_3c972b3
c2eca81cf.jpg,w_a9304b9 new_whale w_da2d813 w_46ccc6f w_89f6097
c2f1cc8ba.jpg,new_whale w_f9b13d2 w_6c3ec2d w_92f4498 w_694a615
c2fe243a5.jpg,new_whale w_f408b56 w_2211e6d w_2b069ba w_14330a0
c303faac6.jpg,new_whale w_e05c1a2 w_cc00be9 w_3bb142c w_1f8c439
c3077f299.jpg,w_107b98e new_whale w_7918564 w_f459442 w_f0fe284
c30809043.jpg,new_whale w_b3cde16 w_45473b9 w_f71100b w_6cec90c
c30a575df.jpg,w_17b0d3a new_whale w_ae6ac74 w_d0bfef3 w_81d1ff9
c30b9a86e.jpg,w_66e3287 new_whale w_4bf625b w_8ad2534 w_1a70f3a
