Image,Id
412d0ff87.jpg,w_659bdb8 w_08630fd new_whale w_e1ffbe2 w_d9f8641
4132bade6.jpg,w_2f67f0a new_whale w_da011a1 w_8dcdb19 w_86f34e8
413412bd8.jpg,w_e0d3a78 w_d066f46 new_whale w_43d4a64 w_910831a
4134d7579.jpg,w_20df2c5 w_efd4d25 new_whale w_73282ec w_f459442
413726cf3.jpg,w_41dd026 new_whale w_20dfb69 w_8fb247e w_4182dba
413b7de3c.jpg,new_whale w_c1bab16 w_72f3685 w_59d1835 w_0745b0e
413c76d3f.jpg,w_0637181 new_whale w_3b3f3ce w_a190a88 w_6555d06
41508a65c.jpg,w_99b7ba2 w_79a2659 new_whale w_d49d4d7 w_bace126
4156fa826.jpg,w_671b041 new_whale w_22d96e7 w_a491df7 w_21b3c7e
415859149.jpg,w_a0f456b new_whale w_22d96e7 w_7efe670 w_7d458aa
415955dff.jpg,w_2a1a012 new_whale w_e70a3d0 w_d405854 w_6579856
41624877d.jpg,new_whale w_14330a0 w_ae393cd w_4b5ade3 w_f459442
4162cdf2d.jpg,w_c0d11da new_whale w_06d2e72 w_fa2ec89 w_abc82c3
4167bc057.jpg,w_9c89384 new_whale w_1c6465a w_be06898 w_ebdc496
416b172fa.jpg,w_a26cf66 w_92a47eb w_13ae3d4 new_whale w_76a45de
417537581.jpg,w_c509e1e new_whale w_894296c w_7c82391 w_1a7ccaf
41786fe02.jpg,w_2d99567 new_whale w_d0bfef3 w_cbda0d3 w_e5978cf
4188acc6e.jpg,w_83869d3 new_whale w_a3d2008 w_b9264dd w_990921b
41a023288.jpg,new_whale w_659bdb8 w_e1ffbe2 w_0027efa w_099bcbc
41b2db718.jpg,w_6ab76e6 new_whale w_04f5a19 w_5cc8711 w_26a55ed
41b715a70.jpg,w_4bf625b new_whale w_d73c048 w_4312b77 w_3cc7dc4
41c3b6350.jpg,w_564a34b w_c2a1bc4 w_bf2b915 new_whale w_23a388d
41c670582.jpg,new_whale w_fd3e556 w_4e275ed w_77c86af w_5c2bc89
41cabd283.jpg,w_8bcf8fc new_whale w_6eb10d2 w_c2397a4 w_5793f1c
41d6736e1.jpg,w_4690940 new_whale w_ac80688 w_1be76f5 w_bc62c27
41e2e2b8a.jpg,w_af48048 new_whale w_13c1b55 w_0b1e4a6 w_fa2ec89
41e610725.jpg,new_whale w_059d9e0 w_94f41dc w_22d96e7 w_e2c24d2
41e6a3730.jpg,new_whale w_066ddc5 w_a63cd8d w_2964e0b w_989e081
41fa1907c.jpg,w_551f361 w_36f2ebb new_whale w_e2c24d2 w_f829227
41fdd6353.jpg,w_eb13108 new_whale w_4dac709 w_6823268 w_bd1c3d5
420f8bb80.jpg,w_ddb62c2 w_c028816 new_whale w_4ea4f59 w_dc651ad
4213af5f9.jpg,w_1887b5a new_whale w_6cfa650 w_88b3466 w_3eae264
42238704c.jpg,new_whale w_ed1df50 w_97f4b38 w_ae6ac74 w_2843a30
4225821f1.jpg,w_01f14e1 new_whale w_921cdae w_d0bfef3 w_d853d93
4236d6e2f.jpg,new_whale w_817d53c w_3f5e8d7 w_186d294 w_56c9d4e
423b09dc4.jpg,w_c684a38 new_whale w_8436e69 w_9da1811 w_c01c1f4
42403ad49.jpg,w_7d6527e w_55a34c7 new_whale w_e1ffbe2 w_803ad0d
42558cde1.jpg,w_5c4f274 new_whale w_df1f698 w_45a6d4e w_6525e6b
425653ca9.jpg,w_ec16cc4 new_whale w_df32eec w_ea6a7fe w_ea05006
4257fb8cc.jpg,w_d0a7600 new_whale w_ab41d9b w_72db52b w_17ba5e4
425988365.jpg,w_7547b9a new_whale w_ac2c28e w_f8dc1cc w_6a95be3
426dec492.jpg,w_f2dd08f new_whale w_d5d084c w_99e43ae w_f9b13d2
4274a4a01.jpg,new_whale w_5665c80 w_8f1069a w_1f7c696 w_1104cca
4276cbefd.jpg,new_whale w_a8d89df w_26ba5fd w_adedd1f w_f1ec368
428c6e2c9.jpg,w_dcd9088 new_whale w_cc1784d w_551f361 w_8ace2d9
429092893.jpg,w_4c62681 new_whale w_60ce6fc w_f9112ac w_4a9436a
429521aa4.jpg,w_8f1069a w_1e286e0 new_whale w_8a1b71c w_688590b
4298f0c46.jpg,w_bfcad53 new_whale w_8f1069a w_5f5f9ae w_6f7611c
42a640c8d.jpg,new_whale w_b51e6f6 w_98f2705 w_a8fcebc w_22d96e7
42a8b0037.jpg,w_d573a68 new_whale w_98a5e5e w_191bce3 w_96985c1
42c069225.jpg,new_whale w_a8f7906 w_19fb122 w_77c86af w_eb3f1ff
42c3ac658.jpg,w_06619ff new_whale w_620dffe w_707ce0f w_e6d9cdd
42e1c56c4.jpg,w_f0eddab new_whale w_4ff2f4a w_71b9a85 w_06d2e72
42f3c9a12.jpg,new_whale w_564a34b w_c01c1f4 w_2f1488c w_ce4d993
42fd01c26.jpg,new_whale w_3c64b50 w_9697236 w_53ce2e1 w_396c07d
4302c9c2b.jpg,new_whale w_7150989 w_5c4f274 w_5796069 w_b9e5911
430518efc.jpg,w_20950a9 new_whale w_9297b97 w_274397d w_691f2f6
430c15a2b.jpg,w_89a0473 new_whale w_e8b82f6 w_286d2cc w_ec98537
43183e0ce.jpg,new_whale w_9b69214 w_dcbdd01 w_6c09f7f w_264c2e1
431ca9ea6.jpg,new_whale w_921cdae w_ad6df15 w_8443156 w_9ad3618
4332a7705.jpg,w_f765256 w_e71f9c7 new_whale w_4b5ade3 w_733f661
43547670a.jpg,w_04d4568 new_whale w_2b49489 w_97ba78a w_4bf625b
4358b4875.jpg,w_9cf0388 new_whale w_abc5af2 w_5a9abcf w_564a34b
4363c8a0a.jpg,w_1f0cf0a new_whale w_e05c1a2 w_8675aac w_ab2ac77
4368ed8a7.jpg,w_1a70f3a new_whale w_3584852 w_4bf625b w_003bae6
436a17e9a.jpg,w_5d687a9 new_whale w_b1d49c5 w_8ad632d w_8f1069a
438ebf566.jpg,new_whale w_261878d w_b805777 w_281a8cd w_8d76b75
438ff3dc5.jpg,w_18934ab new_whale w_15805cd w_553d1ef w_6f0cbe3
439c4ab88.jpg,w_6b1d160 new_whale w_fd3e556 w_53feb91 w_c01c1f4
43a0a18e7.jpg,w_ac51301 w_9eb2d2a new_whale w_57abc0f w_e71f9c7
43a7e2f99.jpg,w_6e76427 new_whale w_8ea9f68 w_7d09141 w_191bce3
43b6f8155.jpg,w_0da34d3 new_whale w_c55519c w_625e590 w_a8f7906
43b9bae73.jpg,w_a7067d1 new_whale w_3da0eae w_b4d0c14 w_ece94e8
43be3b77f.jpg,w_92a47eb new_whale w_fbcfe74 w_010f858 w_1a70f3a
43c9109e7.jpg,w_ea05006 new_whale w_d8de44c w_ae8982d w_714f89f
43e35c1b6.jpg,w_57db059 w_972e51e new_whale w_2211e6d w_a113b33
43e638482.jpg,new_whale w_c4232a3 w_e05c1a2 w_cb4182e w_b21cfe4
43f96d510.jpg,w_e1f57e7 new_whale w_2aaa3b5 w_6aab519 w_f70c302
43fc07441.jpg,w_0b1e4a6 new_whale w_fa2ec89 w_0027efa w_57abc0f
43fe9e728.jpg,w_ae19ff0 new_whale w_91037a7 w_60aa749 w_d01f587
43fef2b47.jpg,w_659bdb8 w_f276da3 new_whale w_fec5547 w_b9d5945
44129d8a8.jpg,w_ae19ff0 new_whale w_b8e1687 w_2fec5ea w_3384715
441349700.jpg,new_whale w_6cfa650 w_ae32f8b w_f74a89e w_00b3dc2
44193cb83.jpg,new_whale w_470be90 w_358c519 w_63f5740 w_95b8b64
4421a2118.jpg,new_whale w_20dfb69 w_e13f4e8 w_23e1d57 w_08630fd
443b91c5f.jpg,new_whale w_38de45d w_a8276b4 w_df1f698 w_90f0cd0
443c0b704.jpg,new_whale w_24d3109 w_ecb61a0 w_022b708 w_fd3e556
444226bf3.jpg,w_d395243 new_whale w_9d59be4 w_bd18f3c w_b35b19d
44450604e.jpg,new_whale w_9c506f6 w_4441671 w_28a16b0 w_217fc01
444878636.jpg,w_80d945b w_c0d11da new_whale w_e08506c w_0cfae04
445f42f79.jpg,new_whale w_27a6304 w_2b47174 w_14ece76 w_c5e1472
446334df7.jpg,w_ec16cc4 new_whale w_c25d2d1 w_fe15413 w_5f54045
44647d086.jpg,w_6ebfe7b new_whale w_50e8d58 w_9c89384 w_0cfdaa5
446b3bb88.jpg,new_whale w_e73d9a5 w_cf5e3ee w_16362a6 w_43d4a64
44703e74b.jpg,w_62c76f3 new_whale w_2fe1c3f w_afdac76 w_1032fa3
447f4675f.jpg,new_whale w_c8e2df4 w_6c995fd w_0bbc3cb w_cb0aaf0
4488b7c7d.jpg,w_cc85af7 new_whale w_3716cec w_347e43b w_1be76f5
448d95ec2.jpg,w_0f03c44 w_e99e430 w_bacd6f4 new_whale w_efa100e
44a0d23a4.jpg,w_971d191 new_whale w_e07b79f w_8ad2534 w_4441671
44a464f19.jpg,w_1efbb8e new_whale w_e906edd w_ce4d993 w_2211e6d
44a526b80.jpg,w_87b0e69 new_whale w_07cc9c2 w_4bf625b w_3584852
44c93c3ca.jpg,w_55ed30b new_whale w_4b5ade3 w_22d96e7 w_cbaa911
44d59c973.jpg,w_fbfe96b new_whale w_f953704 w_7a1c290 w_4ff2f4a
44d735f0a.jpg,new_whale w_990921b w_8d8d839 w_6dce358 w_df1f698
44df8a0e1.jpg,w_334d7eb new_whale w_7a8ce16 w_17338da w_b805777
44ead2b9f.jpg,w_8d0a2a2 new_whale w_179c9f0 w_1666216 w_4dac709
44eb9992d.jpg,w_fbcfe74 new_whale w_b397217 w_51a0ec9 w_396c12b
44f2e4f38.jpg,w_3e979c0 w_1032bb6 new_whale w_c6b4d61 w_4c62681
45058a81c.jpg,new_whale w_a3d2008 w_780c931 w_ffa542b w_7c1435e
45069a190.jpg,w_72f3685 new_whale w_522e959 w_0745b0e w_4c01b28
45108afa4.jpg,w_d405854 new_whale w_e2a09d4 w_853aa18 w_4112f9a
4511f2fca.jpg,w_4b5ade3 new_whale w_6cda039 w_b938e96 w_0f56fb2
451d9aaec.jpg,new_whale w_c01b2e9 w_fc6dd24 w_8f1069a w_4eb6bcc
4525f3d5b.jpg,w_d90a890 new_whale w_7e0659e w_5ae026a w_470be90
452b15c9d.jpg,w_1efbb8e new_whale w_4c62681 w_abba153 w_958b730
45394b76c.jpg,w_38c6a8d w_bc285a6 w_d8de44c new_whale w_88065f2
454cc47c5.jpg,new_whale w_92f4498 w_d066c0a w_c563492 w_df86a42
455ed0ae6.jpg,w_b70c09f new_whale w_1032fa3 w_789c969 w_89f6097
45601a68e.jpg,new_whale w_b9d5945 w_2c3c217 w_ff2157c w_902f8b0
45627d1e5.jpg,w_a113b33 w_da011a1 new_whale w_9800d65 w_db1f3de
45659632d.jpg,w_0abdaf4 new_whale w_e1c5b57 w_b18df25 w_a9304b9
456746457.jpg,new_whale w_9b5d7b1 w_91c94ad w_8675aac w_4b8638b
45708aeeb.jpg,new_whale w_2cabd62 w_f2dd08f w_6fe5b8e w_7a61cb2
4582d20d0.jpg,w_416168a new_whale w_f1b6eea w_68ed1f9 w_c1d2d7f
4592f3641.jpg,new_whale w_abc5af2 w_0749e87 w_eaed433 w_8c25681
459d3e53b.jpg,w_d6aa3f3 w_f3b2948 new_whale w_8507818 w_9353e7c
45a012573.jpg,w_a79a828 new_whale w_2d1592c w_69efdbe w_9eb2d2a
45a3099d3.jpg,new_whale w_18934ab w_ab2ac77 w_139d19a w_d2b440e
45a37404e.jpg,w_4112f9a new_whale w_61b9586 w_b5c90a5 w_06d2e72
45b0f1167.jpg,w_4dac709 new_whale w_691f2f6 w_f6c5343 w_bd1c3d5
45b408a2e.jpg,new_whale w_8778b22 w_d853d93 w_f77e282 w_921cdae
45b6618f6.jpg,w_61b9586 new_whale w_cefd512 w_b71ac68 w_69b5ace
45b6a301d.jpg,w_8a06b46 w_1b0db58 w_3c972b3 w_7648ac1 w_5d687a9
45b82d9b0.jpg,new_whale w_34120de w_8e63d5c w_ab2ac77 w_3bf2653
45b89a418.jpg,w_6bab2bd w_38c6a8d new_whale w_8778b22 w_e2c24d2
45c235dbb.jpg,w_36fdacd new_whale w_bfcad53 w_0027efa w_107b98e
45d0e27ae.jpg,w_c566a3d new_whale w_454f511 w_5d1b1a7 w_3f78360
45d6358a6.jpg,new_whale w_4f9c015 w_51e0e04 w_b99f945 w_26c0ffd
45e6a9482.jpg,w_4bf625b new_whale w_ddf876d w_518a722 w_04d4568
45ec46f81.jpg,new_whale w_4ea4f59 w_cb622a2 w_1457f13 w_bde0cd0
45ec4929c.jpg,w_310226c new_whale w_20eeb29 w_4562f42 w_1af6b9a
45f1f7f8e.jpg,w_1887b5a w_c97ad94 new_whale w_83e0076 w_180e241
45f8c9aad.jpg,w_c183657 new_whale w_43fa7fc w_efa100e w_df1cc01
460b15ff3.jpg,w_7b098ce new_whale w_40be8d6 w_f765256 w_fa2ec89
460dc85f3.jpg,w_4b5ade3 new_whale w_fc90f18 w_733f661 w_650f587
460fd63ae.jpg,new_whale w_4b1a9b1 w_fa2ec89 w_d97c490 w_9297b97
4614dfe6a.jpg,w_e21b629 new_whale w_4135cb8 w_14b1427 w_e66ced8
461b560c0.jpg,w_e71f9c7 new_whale w_2211e6d w_6aca6f9 w_5d35047
463124f2e.jpg,w_d8de44c new_whale w_10d9667 w_aa3489d w_62bedea
4632a4c04.jpg,w_73435d0 w_1f429ff new_whale w_eb31833 w_662c89b
463f9e071.jpg,w_5821157 new_whale w_750f1c8 w_0a87ea4 w_4e1e04d
46434c78b.jpg,w_b397217 new_whale w_8092ea7 w_1a70f3a w_f9aab0c
46464267b.jpg,w_8d76b75 new_whale w_f2075ef w_329ec8b w_cb622a2
46471ad77.jpg,w_a33ed90 new_whale w_07768b0 w_1b0db58 w_53feb91
4648813f9.jpg,w_9be7408 new_whale w_2211e6d w_c1b34d2 w_63d6920
4649aac7c.jpg,w_c98aaad new_whale w_e9b4719 w_2964e0b w_8ae65ef
4653c575c.jpg,w_71df35a new_whale w_5821157 w_ae24bd1 w_ec98537
465b5b1ab.jpg,new_whale w_b57a7be w_e1f57e7 w_f276da3 w_470be90
465e088f4.jpg,w_8c8f8b6 new_whale w_df71327 w_13aa123 w_7537a43
4668afb52.jpg,w_a053ed9 new_whale w_7547b9a w_b5c3634 w_c11f9d8
466b4b86a.jpg,w_0b1e4a6 new_whale w_7648ac1 w_61b9586 w_0027efa
466d6f7e6.jpg,w_f8511e9 new_whale w_9be7408 w_81f8d47 w_787af6b
4671c5038.jpg,w_1f7c696 new_whale w_b9d5945 w_72f5c64 w_4951cb9
4677897ba.jpg,w_4c62681 new_whale w_db68456 w_3eae264 w_4dcdda3
467c10faf.jpg,w_18a06fd new_whale w_ae19ff0 w_bfcad53 w_c815410
467e1c455.jpg,new_whale w_d0bfef3 w_f1b6eea w_d6f0be4 w_9ad3618
4681023f8.jpg,new_whale w_b2bc0c9 w_396c12b w_7d44896 w_0ea7436
468d95ecf.jpg,w_dd944b7 new_whale w_f953704 w_6ca173f w_0887d9b
468ebecdc.jpg,w_50e8d58 new_whale w_08630fd w_611d18b w_cda3971
4694081ba.jpg,w_18ca0f1 new_whale w_b9d5945 w_4e73055 w_d8ae71c
46a2611b1.jpg,w_700ebb4 new_whale w_cd6743e w_85d9229 w_7cc7ec6
46a38d31d.jpg,new_whale w_5ae026a w_c4862bb w_f0663e5 w_29e8496
46a487658.jpg,w_8be0240 new_whale w_ae6ac74 w_e86689c w_23a388d
46b997839.jpg,w_921cdae new_whale w_551f361 w_cc1784d w_30f2f0f
46b9a8b9f.jpg,w_6bab2bd w_ccc26ea new_whale w_a34d26b w_059d9e0
46bc240d4.jpg,w_8e3a722 new_whale w_409747f w_84dadae w_9a77724
46c0cf150.jpg,w_8a6a8d5 new_whale w_69b5ace w_8431ae8 w_df1f698
46c867eb5.jpg,w_fd14088 new_whale w_f39c242 w_c5ee28a w_8ca7f37
46cf7a2e4.jpg,w_00d50c9 new_whale w_f06439d w_518a722 w_620dffe
46d03f4a4.jpg,w_0a87ea4 new_whale w_c4862bb w_470be90 w_85923bb
46e1c45d7.jpg,w_3bf2653 new_whale w_2745292 w_34120de w_05cc23c
46e609d73.jpg,w_455bc02 new_whale w_5b463cf w_0637181 w_3853f4b
46ef139c6.jpg,new_whale w_6e6a6ff w_872f131 w_f5bf6df w_22d96e7
46f49e8a7.jpg,w_68eaf36 new_whale w_58d3dd3 w_43f0465 w_f812227
46f679d2c.jpg,new_whale w_fbc7895 w_009c9c5 w_0833a92 w_53feb91
46fc45e4d.jpg,w_6dbfd7a w_fbcfe1a w_633ead1 new_whale w_dab2353
47075d7d7.jpg,new_whale w_a8c2847 w_5ae026a w_0bfc890 w_d3d9c3c
47079ee6e.jpg,w_68eaf36 new_whale w_a6a1bea w_81eb375 w_f408b56
47166e300.jpg,w_bc285a6 new_whale w_9ad3618 w_15bf3e3 w_cf25b84
4729fe662.jpg,new_whale w_2c3c217 w_9b5d7b1 w_dc642b6 w_46ccc6f
472ec03f1.jpg,w_8ca7f37 new_whale w_6dbfd7a w_234713b w_26ba5fd
47348de71.jpg,new_whale w_2972f31 w_89f6097 w_16df050 w_a113b33
4734beb51.jpg,w_0aed03f new_whale w_953b7b2 w_6cfa650 w_bd1c3d5
47380533f.jpg,w_0886321 new_whale w_57bc12e w_1006b9c w_6332313
4738631da.jpg,w_234d686 new_whale w_7e1ce0a w_d0bf381 w_d494351
473b858d4.jpg,new_whale w_b60ef24 w_b20b425 w_fdfd867 w_c4862bb
473c55dc8.jpg,new_whale w_714f89f w_2972f31 w_6e76427 w_cd4cb49
473d7de64.jpg,new_whale w_488865e w_778e474 w_c1efffb w_7e579dd
4740c8f33.jpg,w_9b46d56 new_whale w_2d0cfc1 w_659bdb8 w_e1ffbe2
474464104.jpg,w_f9d1114 w_c3d896a w_3cd4d35 new_whale w_bcf69e9
47469d8f1.jpg,new_whale w_5d6ba39 w_307e5e9 w_7d4d7cd w_f793b1f
4754bacc1.jpg,w_6822dbc w_ab2f0eb new_whale w_6dbfd7a w_fd3e556
476a420af.jpg,new_whale w_ea902fb w_9b16b48 w_c01c1f4 w_44c1eef
4774d682f.jpg,w_59088ff new_whale w_b8a7ee7 w_0027efa w_5dc4f38
477d2e0f1.jpg,w_04003e9 new_whale w_3c972b3 w_e936b45 w_45246db
477ed5052.jpg,w_f765256 new_whale w_659bdb8 w_23e1d57 w_0135f5f
47878ed4b.jpg,w_218fe4a w_3d834ed w_b9e5911 new_whale w_f0e9af7
478ce2295.jpg,new_whale w_396c07d w_7f762d8 w_c2a1bc4 w_07125ed
478f7286f.jpg,w_2b388fe new_whale w_f648d33 w_91b678a w_1ecca2d
4794ddb2e.jpg,w_334c489 w_e68c38c new_whale w_628a326 w_6c3ec2d
479536cbc.jpg,w_445a265 new_whale w_f408b56 w_f3a12bc w_b9e5911
479672e98.jpg,w_cdb8e7f new_whale w_13edc47 w_81d1ff9 w_e9cf335
47a97edb8.jpg,w_c2de607 new_whale w_ae536d6 w_48a6027 w_7d6527e
47b392f16.jpg,w_f765256 new_whale w_857cb95 w_659bdb8 w_0fdf741
47b98bc59.jpg,new_whale w_60f11fb w_4c07458 w_274d994 w_917cc49
47bb29619.jpg,w_f953704 w_1d2ed91 new_whale w_dcc14b3 w_0887d9b
47cc1827b.jpg,w_2a946f2 new_whale w_64f4963 w_c7d8935 w_68aa903
47daf0d83.jpg,w_c01c1f4 new_whale w_beb062d w_990921b w_5babd8c
48015577e.jpg,new_whale w_bfcad53 w_ddf876d w_29cde7c w_02545ea
4812463ce.jpg,w_2b4b82e new_whale w_d947e85 w_88b3466 w_1887b5a
481d5eff0.jpg,new_whale w_773a8fd w_8e1cf61 w_0531ad5 w_e51c0e9
4821adf19.jpg,new_whale w_29d806a w_465d9c7 w_6f3a3ec w_f0184c0
4821da73f.jpg,w_4c07458 new_whale w_06e4776 w_9b1ee8e w_0bfc890
482a7dd9c.jpg,w_c16cb2c new_whale w_e27bbf6 w_8d9d59a w_b99f945
482da4f35.jpg,new_whale w_26c0ffd w_e70a3d0 w_0f466a5 w_5a2634c
48344693a.jpg,w_7d09141 new_whale w_8d76b75 w_a190a88 w_1f0cf0a
483af88b1.jpg,new_whale w_1f0cf0a w_6bab2bd w_ae6ac74 w_74e6a59
483b2fe0d.jpg,w_63ff0ac new_whale w_76065ea w_102e715 w_60f11fb
483f5f663.jpg,w_e5c28c9 new_whale w_7d458aa w_6823268 w_218fe4a
483f7c658.jpg,new_whale w_a190a88 w_0cc0430 w_61ed07a w_2b47174
48464e588.jpg,w_b30acf8 new_whale w_5823d7b w_ed1df50 w_13c9277
4853537ad.jpg,w_b60e861 new_whale w_343f088 w_9ad3618 w_8443156
485c46f91.jpg,w_62c78f3 new_whale w_b3cde16 w_06a10b4 w_c62ac72
485cba236.jpg,w_e8ab3c8 new_whale w_14a74dd w_3cc7dc4 w_16df050
485da78bd.jpg,w_36f2ebb w_be36790 new_whale w_b4396ae w_6df47c6
48729d453.jpg,new_whale w_361a865 w_88b981e w_401f5a1 w_79843ce
487639247.jpg,w_50c4067 new_whale w_ed2b6f5 w_3c80f07 w_7e0659e
487ba9ccd.jpg,w_3584852 new_whale w_0c5f019 w_470be90 w_2137c6f
487cfb594.jpg,new_whale w_e2372d6 w_fa11a3f w_894296c w_8ad2534
4894a5f94.jpg,w_0637181 new_whale w_8d33cf5 w_53215c6 w_1d9592f
48a3f40a1.jpg,w_1ea5d96 new_whale w_8694cb5 w_931b78f w_20eeb29
48a937823.jpg,w_b495218 new_whale w_acd217a w_d90a890 w_5ae026a
48bc81401.jpg,w_47996c6 new_whale w_a6a732d w_2009f8b w_58d3dd3
48bfffc8e.jpg,new_whale w_9aacaa0 w_b7d68af w_13aa123 w_334c489
48cba11f6.jpg,w_9ad3618 w_b60e861 new_whale w_5591cd8 w_e8aa833
48d1a0776.jpg,w_343f088 new_whale w_9ad3618 w_89f6097 w_e51c0e9
48d380877.jpg,w_80b474e new_whale w_2f1488c w_6d43e1d w_564a34b
48dc51d2a.jpg,w_b9d5945 new_whale w_107b98e w_f765256 w_15805cd
48e26bb1a.jpg,w_cc1784d new_whale w_8b8ef96 w_e818b1a w_7c60e77
48eb11d7f.jpg,w_19fb122 new_whale w_dc27ce9 w_927f345 w_aa0dacc
48edcb488.jpg,w_e12b78d new_whale w_a88c767 w_3384715 w_13ae3d4
48ee3071b.jpg,w_d0bfef3 new_whale w_f9b13d2 w_5841fb9 w_b403feb
48f69d03a.jpg,w_334c489 w_b9d5945 new_whale w_78cfcbf w_b4e9da5
48f921cb1.jpg,w_8d71480 new_whale w_decafbd w_4dac709 w_396c12b
48fa5169f.jpg,new_whale w_4b04d0f w_2df37cc w_ac835f9 w_25085e0
49069f906.jpg,w_ae19ff0 new_whale w_c0f1e04 w_bdded04 w_31438a5
49101674d.jpg,w_0833a92 new_whale w_13aa123 w_a79e00d w_0dc84fd
491d79b8b.jpg,w_c8e2df4 w_0ffa15f new_whale w_a386d0b w_42c1a3c
492a61d86.jpg,new_whale w_d1207d9 w_cefd512 w_8ad632d w_8f1069a
49398f0a6.jpg,new_whale w_f57140c w_4369be0 w_02d138d w_8003858
493bb23ca.jpg,w_6a95be3 new_whale w_cf4178c w_60122fa w_bfcad53
494e29ce6.jpg,w_0bfc890 new_whale w_b953028 w_454f511 w_3fe5d56
494ef322d.jpg,w_af367c3 new_whale w_58d8bbd w_2f8eda5 w_3b71107
4956abeca.jpg,w_2f8de4f w_e66ced8 new_whale w_0027efa w_59109e5
4961607e0.jpg,w_ab7c369 new_whale w_0135f5f w_f765256 w_ba4f96c
49641e593.jpg,w_d0bfef3 new_whale w_83d10c1 w_83869d3 w_5b227ec
497a8fed2.jpg,w_17b0d3a new_whale w_470be90 w_4d06559 w_22d96e7
497e8c4aa.jpg,w_ac51301 w_c01c1f4 new_whale w_df1f698 w_ff2157c
4980014db.jpg,w_40acf40 new_whale w_00656c0 w_e05c1a2 w_709907d
498571d09.jpg,new_whale w_615a631 w_d74498b w_5b463cf w_ab44ae4
498744507.jpg,new_whale w_2ff0834 w_45473b9 w_c9cf75d w_564a34b
4989f4c49.jpg,w_0637181 w_decafbd new_whale w_f1b6eea w_37e61c2
499f1b8ca.jpg,new_whale w_2f67f0a w_f0fe284 w_472b51c w_0a8e080
49a2fb4bb.jpg,w_e2c24d2 new_whale w_242fb46 w_b4396ae w_ac26398
49ab7a7ae.jpg,w_51e7506 new_whale w_6bab2bd w_bd572cf w_dd837b1
49c61bd60.jpg,w_fa11a3f new_whale w_81d1ff9 w_cbd5013 w_a8b65e2
49cd579c7.jpg,w_653099f new_whale w_b9d5945 w_bcba9e8 w_accb0cb
49cd8f929.jpg,w_0a87ea4 new_whale w_8fb247e w_ae19ff0 w_2d5b0e1
49d68fdcb.jpg,w_8f38839 new_whale w_b45ce21 w_b1a3345 w_1e1e5d9
49de6970a.jpg,w_218fe4a new_whale w_cf25b84 w_16df050 w_85b252c
49eccf51f.jpg,w_396c12b new_whale w_df86a42 w_2694603 w_659bdb8
49ef1402e.jpg,new_whale w_6cfa650 w_0bdc5d5 w_37bdff9 w_cfe7928
49fac9953.jpg,w_8a1786f new_whale w_cd4cb49 w_1032fa3 w_242fb46
4a018dac2.jpg,w_8f1069a new_whale w_1e1e5d9 w_8ad632d w_f1b6eea
4a118b84c.jpg,w_91dd720 new_whale w_52093cb w_f0fe284 w_ea67beb
4a1afacbc.jpg,new_whale w_efa100e w_567502c w_71d5ba2 w_c9cf75d
4a254b107.jpg,w_94f41dc new_whale w_6b2ecc8 w_e6dfc39 w_8e88f4f
4a3662cc5.jpg,w_540ac0a new_whale w_68eaf36 w_927f345 w_2211e6d
4a3bfee55.jpg,w_89f6097 new_whale w_0182687 w_ab2ac77 w_714f89f
4a530d349.jpg,new_whale w_f5fcb45 w_0a619af w_abf0b13 w_faf5287
4a6222ff6.jpg,new_whale w_84b255f w_3278209 w_17b0d3a w_d4c24e6
4a63614dc.jpg,w_e9b4719 w_df71327 new_whale w_1faaf06 w_8c8f8b6
4a67a0422.jpg,new_whale w_990921b w_bfcad53 w_2623921 w_d6d89ed
4a805e594.jpg,w_ed1df50 w_650f587 new_whale w_8778b22 w_9714922
4a882d31e.jpg,new_whale w_789c969 w_5a2634c w_d0bfef3 w_1e1e5d9
4a8ab5bb3.jpg,w_beb062d new_whale w_4f6b509 w_c01b2e9 w_40a8585
4a92db15f.jpg,w_54ae8bf new_whale w_f9d1114 w_ab7c369 w_decafbd
4a979e8d1.jpg,w_54e7b40 new_whale w_8a6a8d5 w_b71ac68 w_5821157
4a9a995f9.jpg,new_whale w_99e43ae w_44479bb w_ac80688 w_20dfb69
4aaabf587.jpg,w_dc27ce9 w_af1d57b w_c2426a1 new_whale w_99b7ba2
4ab6eb239.jpg,w_34120de new_whale w_7656c1a w_ea7bc89 w_4af7c01
4ac21b9c5.jpg,w_02d138d new_whale w_1ecca2d w_4112f9a w_928ec6c
4ac21d48b.jpg,w_88e4537 new_whale w_dd944b7 w_ace2814 w_dd54cb2
4acb0858f.jpg,w_50f8a28 new_whale w_4fa0ba1 w_9ddb645 w_fae4be5
4acb90694.jpg,w_c9b4607 w_564a34b new_whale w_bdb3a05 w_990921b
4acd8c1a5.jpg,w_63f5740 new_whale w_c3d896a w_1032fa3 w_3584852
4ad2260ee.jpg,w_74f384b new_whale w_551f361 w_30f2f0f w_1b7eaad
4ae49bc07.jpg,new_whale w_8bcf8fc w_8f38839 w_e05c1a2 w_e5ab551
4af00599f.jpg,new_whale w_535448f w_cc1784d w_d87f911 w_73bfe11
4af2bae5b.jpg,new_whale w_6dbfd7a w_0f56fb2 w_ab7c369 w_38c5952
4af2c5f98.jpg,w_f892ca8 new_whale w_40be8d6 w_653dde1 w_fa2ec89
4af58beb4.jpg,w_f2075ef w_5ed2a38 new_whale w_f1ec368 w_ecd734e
4afb9eb3c.jpg,w_13edc47 new_whale w_cb50f6e w_87ed7a9 w_3e4a1a5
4b1222c82.jpg,w_87b0e69 w_57aeea3 new_whale w_e11afff w_8f1069a
4b24dd763.jpg,w_625e590 new_whale w_3879fa0 w_95c932d w_2b4b82e
4b317dd80.jpg,w_89f6097 new_whale w_0369a5c w_23a388d w_6b25530
4b31a3f4d.jpg,w_e2c24d2 new_whale w_ad6df15 w_5d1b1a7 w_b953028
4b3ade927.jpg,new_whale w_d90a890 w_e6d9cdd w_a67b4e6 w_73bfe11
4b4345266.jpg,w_45246db new_whale w_7b098ce w_51e0e04 w_8ace2d9
4b4c65d30.jpg,w_e145c7a new_whale w_424b5fd w_da40b39 w_76a45de
4b4cb7651.jpg,w_ec16cc4 new_whale w_73d71d2 w_faf5287 w_36f2ebb
4b709d83b.jpg,w_06d2e72 new_whale w_58d3dd3 w_e66ced8 w_e21b629
4b732fd59.jpg,w_7cc7ec6 new_whale w_591a2c5 w_dee1053 w_cd6743e
4b75409fc.jpg,w_ab7c369 new_whale w_a473267 w_e01ca20 w_1419d90
4b795e86c.jpg,w_3057209 new_whale w_9b5d7b1 w_7cc7ec6 w_ebdc496
4b8943e01.jpg,w_3c80f07 new_whale w_80dfb8e w_0886321 w_12e7c23
4b925e1f7.jpg,new_whale w_efa100e w_81eb375 w_e13f4e8 w_564a34b
4b98bfaa9.jpg,w_ea902fb new_whale w_3cb4838 w_d7aad03 w_5597026
4b9925e93.jpg,new_whale w_327175f w_e2c24d2 w_0a87ea4 w_f1b6eea
4b9c984b3.jpg,new_whale w_e9b4719 w_5fedd5f w_32da935 w_fbc7895
4badcf6dd.jpg,w_e7de767 new_whale w_44a6509 w_b44e89d w_31438a5
4bb2557cd.jpg,w_83e0076 new_whale w_e906edd w_67a9841 w_f765256
4bb56cdd8.jpg,w_efbdcbc new_whale w_e66ced8 w_47996c6 w_2009f8b
4bb651519.jpg,w_cac9bdb new_whale w_a074110 w_deedca6 w_3cd4d35
4bc14831a.jpg,w_68eaf36 w_f9a9dec new_whale w_5babd8c w_4135cb8
4bd973b48.jpg,w_2df37cc w_df27de9 new_whale w_e7de767 w_3c8f7da
4bf48759d.jpg,w_b9e5911 new_whale w_efa100e w_7571b52 w_43f0465
4bf84920b.jpg,new_whale w_307e5e9 w_5841fb9 w_72aa314 w_8f1069a
4c020946d.jpg,w_4441671 w_d16eb60 w_e739a48 new_whale w_92c4ea5
4c0c1c29a.jpg,w_88e4537 new_whale w_db3cfa4 w_62bedea w_6aa9d4e
4c0cb7c7b.jpg,w_0ee9ae5 w_003bae6 new_whale w_ef83760 w_ae393cd
4c0ceac84.jpg,w_ec16cc4 new_whale w_186d294 w_36fdacd w_ac26398
4c162dd64.jpg,new_whale w_fec331a w_3da0eae w_729290b w_00d5e98
4c19ff6a0.jpg,w_bc285a6 new_whale w_ed50c26 w_f0fe284 w_e11afff
4c49657e3.jpg,new_whale w_e3582ac w_4e1e04d w_3bb142c w_d5d111d
4c4c984e5.jpg,w_9c68fe8 new_whale w_f0eddab w_6f9f759 w_27aa28c
4c594bc0f.jpg,w_b2606f3 new_whale w_e6325d7 w_180e241 w_fa2ec89
4c61badb7.jpg,w_5d1b1a7 w_714f89f new_whale w_1ccea93 w_fb02461
4c67dbaa9.jpg,w_68c4ecf new_whale w_688590b w_66168f1 w_ddf876d
4c73b7bf5.jpg,w_6822dbc new_whale w_ab7c369 w_26ba5fd w_a8d89df
4c775306c.jpg,w_45246db new_whale w_8a06b46 w_e1c9a18 w_1c63738
4c7cc130d.jpg,w_f793b1f new_whale w_b9d5945 w_e9b4719 w_186d294
4c8a67ef7.jpg,w_8003858 new_whale w_e1ffbe2 w_edce644 w_da011a1
4c8b7aa93.jpg,new_whale w_32da935 w_b7b1472 w_066ddc5 w_5665c80
4c90060d8.jpg,w_8fb247e new_whale w_76a76ca w_76a45de w_0bbc3cb
4c910047d.jpg,w_1f7c696 new_whale w_be5615a w_0a87ea4 w_cb50f6e
4c955a088.jpg,new_whale w_e818b1a w_50e8d58 w_73d71d2 w_20dfb69
4c9e3d03b.jpg,w_ae19ff0 new_whale w_2fec5ea w_5313587 w_6eb10d2
4ca1edeb0.jpg,w_659bdb8 w_2d7c2dd new_whale w_81f8d47 w_3eae264
4ca27c9c4.jpg,w_81d1ff9 w_80a59e6 new_whale w_714f89f w_4ea4f59
4caef1b7c.jpg,new_whale w_065ee1b w_ac33bfe w_c2c20eb w_a10e633
4cb865beb.jpg,new_whale w_89f6097 w_ab44ae4 w_343f088 w_692574d
4cbdbb886.jpg,new_whale w_f1b6eea w_d0bfef3 w_fbf7d73 w_54ae8bf
4cc2d18ff.jpg,w_0292e15 w_f2d26f2 new_whale w_a6eaf8d w_a3bb16b
4cc4b8a69.jpg,w_51fc1fc new_whale w_73282ec w_5fcf350 w_8431ae8
4cccd5b04.jpg,w_72f3685 new_whale w_9ece6cb w_3716cec w_e42007e
4cd4f4e2f.jpg,w_5cc8711 new_whale w_1fb652d w_cc85af7 w_384e3b2
4cd6b39ec.jpg,w_e4b4611 new_whale w_5cc76f8 w_37bc202 w_3384715
4cdcac8a5.jpg,w_6dbfd7a new_whale w_564a34b w_9ddb645 w_daeba33
4cdd31702.jpg,new_whale w_2f1488c w_bd26110 w_fa2ec89 w_fd6a3ad
4cf6d4672.jpg,w_fdfd867 new_whale w_bace126 w_3207433 w_659bdb8
4cf7723a8.jpg,w_ac51301 new_whale w_1efbb8e w_966b510 w_d9405b3
4cf8b7c49.jpg,w_b8a7ee7 new_whale w_e4a9205 w_6dbfd7a w_bd572cf
4d124a041.jpg,w_807f02e w_ae19ff0 new_whale w_15951db w_470be90
4d1998606.jpg,w_8778b22 new_whale w_29af733 w_e8aa833 w_3180b48
4d24a354f.jpg,w_faad2b1 w_e819d10 new_whale w_b6ad668 w_564a34b
4d24e7128.jpg,w_88065f2 new_whale w_2972f31 w_99e43ae w_85b252c
4d24f03da.jpg,w_2b4b82e new_whale w_5babd8c w_f74a89e w_990921b
4d2f1d959.jpg,w_28c330c new_whale w_2137c6f w_358c519 w_8f4d879
4d31ac4d6.jpg,w_6c995fd new_whale w_f9a9dec w_b70c09f w_5778858
4d35014a3.jpg,new_whale w_4ff2f4a w_14330a0 w_7e1ce0a w_a165159
4d3e45158.jpg,new_whale w_903c254 w_e1ffbe2 w_56af0a9 w_23e1d57
4d4389e4f.jpg,w_564a34b new_whale w_d3e323d w_a9304b9 w_f056e82
4d47deef2.jpg,w_f4e69f1 w_e07b79f new_whale w_f1b6eea w_985d205
4d52e76e6.jpg,w_3dc1e42 new_whale w_6e97ef4 w_217fc01 w_bacd6f4
4d56f9a3e.jpg,w_36bbd71 w_6041acb new_whale w_262c32f w_69b5ace
4d57d2de2.jpg,new_whale w_2972f31 w_b805777 w_ece94e8 w_88065f2
4d6854a21.jpg,w_6e0a45b new_whale w_d0ce152 w_8c8f8b6 w_a3d2008
4d685a22c.jpg,w_dc76f1c new_whale w_eaed433 w_3a241cf w_3976c05
4d6f75679.jpg,new_whale w_49e0d44 w_14330a0 w_ad6df15 w_753d66c
4d7d05016.jpg,new_whale w_92f4498 w_d6d89ed w_71b9a85 w_0887d9b
4d84f7105.jpg,new_whale w_c1b34d2 w_9032a74 w_1834b49 w_20dfb69
4d8bbe17b.jpg,new_whale w_b72cdc1 w_003bae6 w_bcba9e8 w_fd3e556
4d9a56c4b.jpg,new_whale w_7cc7ec6 w_64404ac w_22d96e7 w_7348ed5
4dc51cdcf.jpg,w_ea7bc89 w_88b3a3d new_whale w_ce8aa12 w_5c2bc89
4dcb78207.jpg,new_whale w_36bbd71 w_32838db w_6c09f7f w_d3582f2
4dcd5e7e5.jpg,new_whale w_b9d5945 w_939423d w_23e1d57 w_bb2cbcf
4dd0e734a.jpg,w_c156d0a new_whale w_c8e2df4 w_b8b8383 w_dea042e
4dd20d613.jpg,w_e2c24d2 new_whale w_242fb46 w_25085e0 w_d8de44c
4dd236ff0.jpg,w_0531ad5 w_f602022 new_whale w_75f6ffa w_a9304b9
4dd2ee317.jpg,w_89f6097 w_43d4a64 new_whale w_d307d9d w_4d62749
4df01b1d9.jpg,new_whale w_45246db w_5fcd8d4 w_5d426b6 w_689cfe2
4df0f5618.jpg,w_6cfa650 new_whale w_f765256 w_bd1c3d5 w_a113b33
4e04e1656.jpg,w_f3b2948 new_whale w_15805cd w_9fc06d4 w_10f67bb
4e084d293.jpg,w_7091e67 w_f2dd08f new_whale w_f0184c0 w_6b47687
4e09edc85.jpg,w_5b463cf new_whale w_da08395 w_9d59be4 w_44479bb
