Image,Id
00028a005.jpg,w_22d96e7 new_whale w_ef83760 w_69b5ace w_857cb95
000dcf7d8.jpg,w_b708e98 new_whale w_c1b90d1 w_928ec6c w_4132bb8
000e7c7df.jpg,new_whale w_b403feb w_997cda5 w_ab02160 w_dfc200b
0019c34f4.jpg,w_e21b629 new_whale w_08630fd w_600bf1b w_59052ad
001a4d292.jpg,w_2a946f2 w_5688262 new_whale w_2623921 w_274d994
00247bc36.jpg,w_51fc1fc new_whale w_cda3971 w_6b2ecc8 w_dc651ad
0027089a4.jpg,w_7e2eb3d new_whale w_13c8177 w_2745292 w_5ce9577
002de4d94.jpg,w_68bb40f w_7a8ce16 new_whale w_af520bd w_5ed2a38
002f52f0c.jpg,new_whale w_3f22dc6 w_7f4e31e w_87b0e69 w_8c959a6
002fd89d4.jpg,w_d1b3a00 new_whale w_854c18e w_d066f46 w_d3baa35
00313e2d2.jpg,w_15d12c7 new_whale w_b9d5945 w_472b51c w_ae393cd
00379666f.jpg,w_090c801 new_whale w_c543f7c w_92c4ea5 w_8eae2c3
0041a9867.jpg,new_whale w_81d1ff9 w_7ae9946 w_15951db w_688590b
004344e9f.jpg,new_whale w_1e81b43 w_218fe4a w_1666216 w_927f345
0048970f9.jpg,w_2f6d4a8 new_whale w_e1ffbe2 w_659bdb8 w_90fb95b
004fa8ff7.jpg,new_whale w_4f8332a w_69bb761 w_42e0e40 w_11ce746
00512687e.jpg,w_75d4e65 new_whale w_8a6a8d5 w_b3cde16 w_16b5050
006183fb4.jpg,w_e04d084 w_9b5d7b1 new_whale w_5821157 w_99d3313
0061febfc.jpg,w_e897a60 new_whale w_71df35a w_f70c302 w_e1f57e7
0065d4964.jpg,w_f765256 w_e1ffbe2 new_whale w_659bdb8 w_396c12b
00744bd58.jpg,new_whale w_1f7c696 w_d72771c w_1834b49 w_8a06b46
007886aef.jpg,w_9ad3551 new_whale w_ebdc496 w_4ab3420 w_1faaf06
008a4bc86.jpg,w_9b5109b new_whale w_a58d6d5 w_ab2f0eb w_40efb29
009dd6c96.jpg,w_f3a12bc new_whale w_61b9586 w_4112f9a w_1ecca2d
00a427ac6.jpg,w_45a768c new_whale w_4ff2f4a w_ac835f9 w_4c62681
00ac0fca6.jpg,w_08d62ee w_72f3685 new_whale w_d066f46 w_85c5adf
00bb36bcf.jpg,w_bf41c21 new_whale w_54e7b40 w_fd6a3ad w_e1ffbe2
00ca82e74.jpg,w_ff2157c w_836e895 new_whale w_b3afb40 w_5d426b6
00ccb53ec.jpg,new_whale w_3384715 w_985d205 w_88065f2 w_2f67f0a
00d101f4b.jpg,new_whale w_c01c1f4 w_32da935 w_53feb91 w_c650f39
00dc02f06.jpg,new_whale w_6b00c91 w_ea902fb w_26ba5fd w_3309cbd
00e94fd56.jpg,w_6525e6b new_whale w_2e374c0 w_b9e5911 w_3879fa0
00edab267.jpg,new_whale w_b9d732d w_7e0659e w_eafacda w_334d7eb
00f44f4e1.jpg,new_whale w_2597710 w_9032a74 w_2497490 w_022d2f5
00ff45291.jpg,w_0a7a37c new_whale w_03e3e5e w_edf0164 w_7a61cb2
01034a160.jpg,w_6441130 new_whale w_3b71107 w_db68456 w_a548534
0110a64a9.jpg,w_3250a08 new_whale w_faac069 w_e906edd w_abba153
011490ea7.jpg,w_4f9c015 new_whale w_7834cde w_72019ec w_394f053
01288355d.jpg,new_whale w_6dbfd7a w_f737a6c w_b9e5911 w_6f0cbe3
012dbdb59.jpg,w_0ee7878 new_whale w_e1ffbe2 w_3cc4623 w_2d0cfc1
0133056d1.jpg,new_whale w_2500327 w_2362d7f w_abb3ee6 w_69b5ace
013cb8d04.jpg,w_13c8177 new_whale w_bece5a4 w_aaf3463 w_396c12b
013e23c3f.jpg,w_04ebfe8 new_whale w_71df35a w_8e88f4f w_896b139
01665bc26.jpg,w_0637181 w_971d191 w_3518604 new_whale w_0f84e7c
0169cec0e.jpg,w_51fc1fc new_whale w_a2a40d2 w_b44e89d w_e2372d6
016bbca6e.jpg,w_f24a55c new_whale w_f4a9357 w_5946cd1 w_fa8c44c
016ca6f9c.jpg,new_whale w_c1d2fbe w_c2a1bc4 w_12e8dc7 w_c7e1b12
0170f741c.jpg,w_a8276b4 new_whale w_2f1488c w_14ece76 w_d6f0be4
0182ae396.jpg,w_98f2705 new_whale w_48872ad w_ccc26ea w_eafeccd
01830c9cf.jpg,new_whale w_fa2ec89 w_4af7c01 w_e906edd w_d980663
01902b965.jpg,w_1b0db58 new_whale w_84f08b7 w_abba153 w_6beaa7d
01b1ecf7b.jpg,new_whale w_72e3fa4 w_8beb9f1 w_1baf8df w_faf5287
01b7a570a.jpg,new_whale w_9e5854c w_6bab2bd w_d5d111d w_08d62ee
01c91eadc.jpg,w_ad672ce new_whale w_3207433 w_093ea58 w_0baf946
01d0bd024.jpg,w_358c519 new_whale w_a8b65e2 w_fccac74 w_a2a40d2
01d48763a.jpg,w_f6eed29 new_whale w_6c995fd w_79843ce w_ee2326a
01d8ab0b0.jpg,new_whale w_5e8e218 w_fe54484 w_c9cf75d w_84f08b7
01d9c00d4.jpg,w_6cda039 new_whale w_564a34b w_3879fa0 w_be4f189
01ddb76dc.jpg,new_whale w_9d86594 w_b2bc0c9 w_c0d11da w_e71f9c7
01e1319b8.jpg,w_888391a new_whale w_81d1ff9 w_4d06559 w_494c72d
01e527ebc.jpg,new_whale w_fbcfe74 w_b2bc0c9 w_13aa123 w_4b4f9b7
01ea0d37f.jpg,w_c4862bb new_whale w_fd3e556 w_065ee1b w_83a4279
01f47d246.jpg,new_whale w_1d0830e w_9ed5f69 w_06ffb30 w_e71f9c7
01f9f858a.jpg,new_whale w_3879fa0 w_8ad2534 w_fe8aee2 w_c62ac72
01fb8d6d7.jpg,w_3de579a new_whale w_6579856 w_6920fb7 w_c0b01ea
020025fbc.jpg,w_cefd512 new_whale w_0f8b8e2 w_d0b330d w_89f6097
02160c50a.jpg,w_b4396ae new_whale w_cf5335b w_63f5740 w_55fffeb
0219364ca.jpg,w_2644b11 new_whale w_bff3c3b w_f2f7550 w_94f41dc
02283cf37.jpg,w_b02ac52 w_4ea4f59 new_whale w_c11f9d8 w_ccf3551
0238ebb55.jpg,new_whale w_4516ff1 w_58d3dd3 w_df1f698 w_b9ee9d1
023ef338e.jpg,w_0d77f32 new_whale w_69b5ace w_ea91c50 w_e897a60
02475f335.jpg,w_9c506f6 new_whale w_28a16b0 w_71d5ba2 w_c815410
0247dd21a.jpg,new_whale w_3de579a w_98f2705 w_e2c24d2 w_b4396ae
024a01a2b.jpg,new_whale w_990921b w_b9d732d w_45473b9 w_fdfd867
0259dec9a.jpg,new_whale w_c62ac72 w_bacd6f4 w_3eae264 w_6caff0f
025bc349d.jpg,new_whale w_3815890 w_5c742ec w_c6fe966 w_43fa7fc
02614d547.jpg,w_c2a1bc4 w_f74a89e new_whale w_6b1d160 w_8ca7f37
02626b1c3.jpg,new_whale w_f4a7ad7 w_26a55ed w_0a0c768 w_c0f1e04
0273758b8.jpg,w_9fecf9d w_2a7f00f new_whale w_6dbfd7a w_066ddc5
0277b3be9.jpg,w_e897a60 new_whale w_ecd734e w_f2075ef w_e2372d6
027a8ca32.jpg,w_cc1784d w_686bbcb new_whale w_c1efffb w_eb3f1ff
027e9ff14.jpg,new_whale w_76065ea w_a589923 w_3b970db w_60f11fb
0294fcaf4.jpg,new_whale w_990921b w_596f6bc w_fbfe96b w_4ff2f4a
02950682c.jpg,w_ea902fb new_whale w_fa2ec89 w_c0d11da w_8dfedae
02a000c65.jpg,w_953b7b2 new_whale w_9b5d7b1 w_90abfeb w_f24a55c
02a7d8a15.jpg,w_a79e00d new_whale w_7250aef w_093d284 w_13aa123
02a9c6f67.jpg,w_99d3313 new_whale w_10a4e10 w_fdceb44 w_17ba5e4
02ab81ee7.jpg,w_c5a7b38 new_whale w_9227ca2 w_5946cd1 w_29d806a
02aff2eda.jpg,new_whale w_cc1784d w_c6fe966 w_f5fcb45 w_6dbfd7a
02b063a20.jpg,w_df32eec new_whale w_bd18f3c w_8443156 w_8be0240
02b4c72e2.jpg,w_fb3959d new_whale w_da011a1 w_7d34a32 w_53215c6
02bd94f1f.jpg,w_22d96e7 new_whale w_0e0b65c w_85bb73c w_13aa123
02bdf0929.jpg,w_37d2f3a new_whale w_79eb216 w_76065ea w_f77e282
02c298e3c.jpg,new_whale w_bcba9e8 w_66168f1 w_961b5c4 w_f71100b
02c583932.jpg,w_0fdf741 new_whale w_e1c5b57 w_c97ad94 w_30f2f0f
02cd0a66b.jpg,w_b2bc0c9 new_whale w_aa0dacc w_003bae6 w_6ebed02
02ce8eb2b.jpg,new_whale w_d5c0064 w_98a87a6 w_e5ab551 w_20eeb29
02cfedaf7.jpg,w_928ec6c w_c1b34d2 new_whale w_dcd9088 w_13aa123
02d726ca2.jpg,new_whale w_f9a9dec w_b57a7be w_45473b9 w_f77e282
02d8e1e1f.jpg,new_whale w_a79a828 w_83e0076 w_af367c3 w_9bd2794
02e409b9d.jpg,w_40a8585 new_whale w_23a388d w_6e76427 w_e2e7384
02eeb5faa.jpg,w_9da1811 new_whale w_3eae264 w_c01c1f4 w_cfae8d8
02ef5fee0.jpg,new_whale w_ae19ff0 w_894296c w_e2c24d2 w_11ff425
02f1b3142.jpg,w_8d33cf5 new_whale w_b403feb w_3716cec w_c2677ee
02fa44546.jpg,w_ad6df15 new_whale w_04f5f55 w_8443156 w_2b39f31
030772a9c.jpg,w_c509e1e new_whale w_11ff425 w_715b1b5 w_4d61be5
03140866f.jpg,w_653dde1 new_whale w_38c8a8d w_20dfb69 w_20950a9
031544171.jpg,w_3eae264 w_63ff0ac w_1289b63 new_whale w_6822dbc
031819a74.jpg,w_1f429ff new_whale w_ab2ac77 w_b8a7ee7 w_eb13108
0318b3c3d.jpg,w_89e559b w_7d09141 new_whale w_16df050 w_90c9763
032a75906.jpg,w_5871dfd new_whale w_6bab2bd w_08d62ee w_af8df07
032dcd794.jpg,w_7e1ce0a new_whale w_14330a0 w_e6264df w_d72771c
033304f3f.jpg,w_88aca21 new_whale w_d73c048 w_40be8d6 w_fa84489
03351bebd.jpg,w_d2c2be0 new_whale w_2d5b0e1 w_773a8fd w_39ea8fa
03376858d.jpg,w_709907d new_whale w_46ccc6f w_60f11fb w_ae6ac74
034b5f550.jpg,w_60122fa new_whale w_2362d7f w_d0a7600 w_773a8fd
034d33a63.jpg,w_6e85f95 w_66e3287 w_ae19ff0 w_e07b79f w_8ad2534
034dc700c.jpg,w_8c25681 new_whale w_cc1784d w_cee684e w_b8b8383
0350e1267.jpg,w_659bdb8 new_whale w_f37c434 w_954fec8 w_2719f85
035285281.jpg,w_a1a4bb2 new_whale w_4846b27 w_6bab2bd w_abc5af2
0356c2829.jpg,w_025911c new_whale w_b4396ae w_3b03149 w_72f5c64
0359ba961.jpg,new_whale w_3f78360 w_f2d26f2 w_1afed1e w_d15dd0b
036ebab77.jpg,new_whale w_7c27fbd w_98a87a6 w_b9d5945 w_f57140c
0372369a2.jpg,new_whale w_2f8de4f w_e99e430 w_bacd6f4 w_36fdacd
0376802cf.jpg,new_whale w_2036a57 w_817d53c w_27b7295 w_d405854
0376c44c1.jpg,w_859dbc3 new_whale w_6822dbc w_43fa7fc w_e20dcb5
0383ee2bb.jpg,new_whale w_4ea4f59 w_f765256 w_db0c7fd w_4b5ade3
03960efed.jpg,w_6beaa7d new_whale w_e71f9c7 w_4a01f24 w_3ffae11
039b04adc.jpg,w_06d2e72 new_whale w_1344da3 w_ea902fb w_8507818
03a154d2a.jpg,new_whale w_a10515b w_5a9abcf w_06d2e72 w_bf41c21
03a8f9dc0.jpg,new_whale w_5e8e218 w_760c469 w_53feb91 w_187de67
03b658f23.jpg,w_f94039d new_whale w_917cc49 w_2b4b82e w_b433be9
03bbcaaf8.jpg,w_e2b0292 new_whale w_45473b9 w_ebcf899 w_1e99233
03bcfbafc.jpg,w_16df050 w_96f027d new_whale w_e6dfc39 w_e2c24d2
03bdbf2a6.jpg,new_whale w_857cb95 w_70fc054 w_fbc7895 w_efc0825
03cbe2800.jpg,w_4661aac new_whale w_fb3959d w_cc1784d w_e6dfc39
03ceb64ce.jpg,w_17b0d3a new_whale w_789c969 w_6c3ec2d w_63f5740
03d9f9959.jpg,w_fd3e556 w_2df85e7 new_whale w_27597ff w_8ca7f37
03e2aaaf9.jpg,w_89f6097 new_whale w_0369a5c w_673ff5b w_2d6596f
03eaaa1bc.jpg,w_c158581 w_74f384b w_d3b1733 w_b3afb40 w_6187461
03eb52c65.jpg,w_a9304b9 new_whale w_50fd107 w_b3196aa w_0118bab
03ee04174.jpg,new_whale w_a2a40d2 w_d853d93 w_242fb46 w_13c8177
03f12f50f.jpg,new_whale w_c7e1b12 w_e1ffbe2 w_f3f887e w_4c62681
03f41c1f2.jpg,w_0a87ea4 new_whale w_ad3a043 w_c9a569d w_26a55ed
03f6f8101.jpg,new_whale w_4bf625b w_41d24c6 w_94e136e w_98f2705
0408fdfa8.jpg,w_08d62ee new_whale w_2f1488c w_14ece76 w_63d6920
041abc157.jpg,w_a4d7e8f new_whale w_2365d55 w_5793f1c w_50e8d58
041bd63fd.jpg,w_4441671 new_whale w_193bf22 w_5c57f77 w_08d62ee
0432f301a.jpg,w_659bdb8 new_whale w_4b5ade3 w_da011a1 w_d73c048
043553c4f.jpg,w_f2075ef new_whale w_92a47eb w_87b0e69 w_3584852
043f01afd.jpg,w_3ec7fa2 new_whale w_c59d4b1 w_7e0659e w_f6eed29
0447d2303.jpg,new_whale w_a3bb16b w_f1b6eea w_bfbf205 w_f5bf6df
045053a13.jpg,w_ee57fc5 new_whale w_dcee281 w_c1acf72 w_8a1b71c
045306b81.jpg,w_ea7bc89 new_whale w_0aed03f w_2e374c0 w_3815890
0453f9eb7.jpg,w_553d1ef new_whale w_15805cd w_84a32d1 w_b9d5945
046474ea6.jpg,w_6d43e1d w_60ce6fc new_whale w_59052ad w_ec32fa6
0474bf615.jpg,w_88065f2 new_whale w_11bd416 w_6bab2bd w_d2b7856
047a40805.jpg,w_b330c85 w_d0528f6 new_whale w_186d294 w_972e51e
047b5bcb8.jpg,w_59052ad new_whale w_2f1488c w_1029215 w_bf41c21
048574198.jpg,w_2645f4d new_whale w_97ba78a w_d01f587 w_e50e9f9
049def6fb.jpg,w_68eaf36 new_whale w_600bf1b w_d140497 w_df1f698
04a5a7aed.jpg,w_f9d1114 w_72aa314 w_98f2705 new_whale w_2fcfc71
04a763f43.jpg,w_0bf90d9 new_whale w_9ad3618 w_df1f698 w_9748a78
04ada1eaa.jpg,w_c5ec693 w_83d10c1 new_whale w_22e82fa w_894296c
04b0f6f59.jpg,new_whale w_1faaf06 w_396c12b w_2f74ff3 w_817d53c
04c0cf092.jpg,new_whale w_e5978cf w_e1f57e7 w_d5c0064 w_bc285a6
04c54975e.jpg,w_cb50f6e new_whale w_9236fb3 w_c6c60c8 w_53215c6
04cd8c8db.jpg,w_68eaf36 w_c6b4d61 w_f408b56 w_63ff0ac w_bacd6f4
04d63dabe.jpg,w_5d81be1 new_whale w_470be90 w_dcee281 w_90f0cd0
04ea55d4d.jpg,w_31438a5 new_whale w_d0e6e7d w_a8b34a0 w_5cc76f8
04eb7096a.jpg,w_23a388d new_whale w_c1efffb w_0833a92 w_62ff333
04ec29ecc.jpg,w_08630fd new_whale w_e2b0292 w_4c62681 w_c6b4d61
04f26a748.jpg,new_whale w_ee318d3 w_010f858 w_8e88f4f w_f1b6eea
05102ebd0.jpg,w_22d96e7 w_5cc8711 new_whale w_1f7c696 w_20c0bc0
051507abb.jpg,w_d829778 new_whale w_a0265bd w_4a8a4c9 w_cd9dec7
0519edcfa.jpg,w_cc1784d new_whale w_d947e85 w_0a619af w_1887b5a
051c05e52.jpg,w_396c07d new_whale w_990921b w_3b90ba7 w_df71327
051f7bd26.jpg,w_3b03149 new_whale w_c405fe4 w_2f67f0a w_ba4f96c
05285d480.jpg,w_61e4690 w_63d6920 w_d953953 new_whale w_75b6e81
05342f3a0.jpg,w_cef693e new_whale w_15f43ea w_8a1786f w_99e43ae
05388dc21.jpg,w_45473b9 new_whale w_2fe1c3f w_b3cf11e w_b4fe6b0
0538d3032.jpg,w_e5c28c9 new_whale w_04acf95 w_0cfae04 w_193f83c
053951fbe.jpg,w_d8a08f8 new_whale w_e66ced8 w_0ee9ae5 w_5bf792a
0543e6030.jpg,new_whale w_438dd0b w_3079e26 w_2b4b82e w_de03861
0547d9c05.jpg,new_whale w_2f74ff3 w_d405854 w_56a96ed w_6d80008
0547fccaa.jpg,w_5665c80 new_whale w_1faaf06 w_853aa18 w_9fc06d4
054f503f8.jpg,new_whale w_73b2fe3 w_d947e85 w_4dcdda3 w_af367c3
055c0a041.jpg,w_1be76f5 new_whale w_3f78360 w_b495218 w_a32ff7f
055ca674d.jpg,new_whale w_f381082 w_3384715 w_4441671 w_465d9c7
0569b3d21.jpg,w_72f5c64 w_0718183 new_whale w_34d7623 w_b9d5945
056c54434.jpg,new_whale w_6579856 w_2f841ea w_13c9a17 w_6e76427
058079d6d.jpg,w_e1c5b57 new_whale w_bd26110 w_0fdf741 w_8eec034
0589c3bcc.jpg,w_b0f07c7 new_whale w_39f3e3a w_0027efa w_659bdb8
0590607d3.jpg,w_8c25681 new_whale w_9b5109b w_463f219 w_894296c
0599dc841.jpg,w_fa2ec89 new_whale w_f57140c w_08d62ee w_6cca536
05abf15c0.jpg,w_010f858 w_44803e4 w_cbdae16 w_5966e55 w_90edcb6
05addb78c.jpg,w_d066f46 new_whale w_0bc078c w_3de579a w_ec4299b
05b6fbe96.jpg,w_e52ff99 new_whale w_bdded04 w_3982e1e w_729290b
05bac8b66.jpg,w_f787e93 new_whale w_e07b79f w_e1ffbe2 w_aee1ccf
05bd2e6bb.jpg,w_c1b34d2 new_whale w_6dbfd7a w_ac33bfe w_298f605
05dfa0c72.jpg,w_6f0cbe3 new_whale w_7c27fbd w_a26cf66 w_ddc5518
05e0da16b.jpg,w_decafbd w_2745292 new_whale w_e2b0292 w_5665c80
05e145d7a.jpg,new_whale w_28218e1 w_56c9d4e w_d405854 w_4135cb8
05f560c71.jpg,w_90c9763 new_whale w_0a155b9 w_e2b0292 w_c566a3d
05ff833b9.jpg,w_81f8d47 w_966f46a new_whale w_fbcfe74 w_928ec6c
0613d30ca.jpg,w_352445a new_whale w_e49ade7 w_c4862bb w_0bc1de9
061f7329e.jpg,w_bc285a6 w_e11afff w_dd944b7 w_94e136e w_98f2705
06200081a.jpg,w_98a87a6 new_whale w_5f20f03 w_a34d26b w_0a0c768
0635c2ac9.jpg,new_whale w_2dd6b62 w_6cda039 w_5485228 w_23e1d57
063752d10.jpg,new_whale w_ec4b5d4 w_5af08bc w_61ed07a w_b93105d
063aa0d9c.jpg,w_ccc26ea new_whale w_dced3f2 w_94da1e2 w_11d8c70
063e305e6.jpg,w_00b3dc2 w_f61b957 new_whale w_b3cde16 w_51e91cb
063f5cd24.jpg,w_ae8982d new_whale w_f0fe284 w_16df050 w_bc285a6
0641ae9b5.jpg,w_c6b4d61 w_163b2b8 new_whale w_b70c09f w_7a61cb2
064561561.jpg,w_fa2ec89 new_whale w_dc651ad w_51e7506 w_bdded04
0646a24b2.jpg,w_1104cca new_whale w_7d458aa w_4167fbb w_5f54045
0646d1690.jpg,new_whale w_ddf876d w_36f2ebb w_b3197c6 w_3a34d6f
0648b2a7c.jpg,w_0aea542 new_whale w_b5e6c9c w_a88c767 w_da011a1
0667cb9e4.jpg,w_3278209 new_whale w_ea520df w_6d8f72e w_7547b9a
068dbd223.jpg,w_a7806ad new_whale w_e6faba8 w_0887d9b w_aec2b6d
069948176.jpg,w_cdc55a8 new_whale w_688590b w_6b25530 w_25183b8
069c0d382.jpg,w_4344f5e new_whale w_d3baa35 w_d5c0064 w_86d0c34
069cdd4b0.jpg,new_whale w_04003e9 w_a87ec7e w_1f1cee1 w_ac51301
06a8cf283.jpg,w_c6fe966 w_6041acb new_whale w_242fb46 w_75b6e81
06af8bc75.jpg,w_36b8101 w_7052419 new_whale w_1b0db58 w_f602022
06b8b398f.jpg,w_4dac709 w_a059841 new_whale w_0815d2c w_23e1d57
06b9c4981.jpg,new_whale w_a7757d4 w_7d44896 w_714f89f w_2df37cc
06baaab99.jpg,w_107b98e w_edf43c1 w_0b1e4a6 new_whale w_a5c74f4
06c46df18.jpg,w_ed620af w_0369a5c w_df27de9 new_whale w_bff3c3b
06d343d71.jpg,w_28c330c new_whale w_692574d w_4ad3d24 w_ece94e8
06d511f0e.jpg,w_8f1069a new_whale w_a8b34a0 w_14330a0 w_d1207d9
06dba2ec2.jpg,w_66168f1 new_whale w_8f1069a w_fbcfe74 w_564a34b
06df3d246.jpg,w_5665c80 w_bef2a3f w_4c62681 new_whale w_9094c50
06e81d948.jpg,new_whale w_335bdd1 w_ea520df w_4a9436a w_33696ac
06e8c3191.jpg,w_17d6235 new_whale w_0baf946 w_5597026 w_cb622a2
06ed4a372.jpg,w_588f349 new_whale w_c6b4d61 w_aa0dacc w_3bf887a
06fa36e08.jpg,w_e1f57e7 new_whale w_7c82391 w_8da30ad w_ac26398
06fdc1fd7.jpg,new_whale w_1104cca w_bd572cf w_990921b w_6caff0f
06ffe116d.jpg,new_whale w_44479bb w_2f841ea w_a053ed9 w_917cc49
07053c913.jpg,w_736cca3 new_whale w_2623921 w_6b47687 w_4562f42
0709abe10.jpg,w_cf25b84 new_whale w_decafbd w_df1f698 w_4ff2f4a
0713b92c6.jpg,w_99d3313 w_1ea8997 new_whale w_23e1d57 w_620dffe
071601cde.jpg,w_7ffc63c new_whale w_c7bd8e7 w_1d0830e w_fc6dd24
0721b6f4c.jpg,w_98f2705 new_whale w_f1ec368 w_bc285a6 w_08c7d09
072a7a777.jpg,new_whale w_45e277d w_f182e2a w_74f384b w_6e7763b
072faed30.jpg,w_990921b new_whale w_564a34b w_db68456 w_27597ff
0734b53b4.jpg,w_0fdf741 new_whale w_691f2f6 w_28218e1 w_7769d46
073f7164e.jpg,new_whale w_e71f9c7 w_52cd115 w_0027efa w_f8478b9
074bf87bd.jpg,new_whale w_a8c2847 w_4441671 w_c7951e0 w_228c7ee
075310467.jpg,w_13aa123 new_whale w_6e0a45b w_cbb15d2 w_6c3ec2d
0754e0839.jpg,w_3c8f7da new_whale w_0fdf741 w_afcf807 w_b7babc0
0757afefe.jpg,w_ba77e9c new_whale w_88e4537 w_26e4f44 w_d97c490
075b9835b.jpg,w_70e9661 new_whale w_2f74ff3 w_242fb46 w_9d29561
075d45125.jpg,new_whale w_95f78f6 w_54fd73d w_d6ca28d w_615a631
075d67fa9.jpg,w_edf0164 new_whale w_f3b2948 w_abfccb7 w_76f4d0b
07623d59a.jpg,w_89f6097 w_f0e9af7 w_cd4cb49 new_whale w_fe03daf
076ae45a9.jpg,new_whale w_b9ee9d1 w_53d6a5e w_9119b08 w_7150989
0773dbd1d.jpg,w_5a2634c new_whale w_e918d4c w_a6f9d33 w_17b0d3a
07774838f.jpg,w_ce4d993 w_1d0830e w_6b1d160 new_whale w_99b7ba2
078434250.jpg,w_5d426b6 new_whale w_f773fbe w_0b398b2 w_08630fd
07910d9c9.jpg,new_whale w_4d7df64 w_dcee281 w_470be90 w_21591ba
07977c560.jpg,w_df1f698 new_whale w_7d6527e w_08630fd w_59052ad
079cd77ac.jpg,new_whale w_dea042e w_04ebfe8 w_8f38839 w_1ccea93
07b3e0fee.jpg,w_dd837b1 new_whale w_6dbfd7a w_22f2567 w_81d1ff9
07c46b13b.jpg,w_535448f w_0833a92 new_whale w_5793f1c w_1f7c696
07d609ea5.jpg,new_whale w_f459442 w_760c469 w_26c0ffd w_5a2634c
07e49d983.jpg,new_whale w_82de056 w_b035775 w_4182dba w_06619ff
07ea475b1.jpg,new_whale w_c4862bb w_bdded04 w_dcbdd01 w_7351540
07f38b137.jpg,w_2df37cc new_whale w_94f41dc w_d3baa35 w_b0ffd3b
07f496bc6.jpg,w_190b9bb new_whale w_242fb46 w_cc1784d w_df34804
07f73b14c.jpg,w_ab44ae4 new_whale w_0a87ea4 w_2ed0acc w_7ba6d48
07f766815.jpg,w_990921b new_whale w_4ff2f4a w_c6fe966 w_8c8c45a
07fa274d3.jpg,w_03670aa new_whale w_68eaf36 w_efa100e w_972e51e
07fbe8f44.jpg,w_a9304b9 new_whale w_02aa597 w_98f2705 w_662530e
08225f99f.jpg,w_5b262f1 new_whale w_4e275ed w_a8f7906 w_d73c048
08306ba62.jpg,w_a9304b9 w_8c56684 w_f6e5311 w_1472271 w_262ec5b
0837690dd.jpg,w_4d06559 w_d5d111d new_whale w_3904b99 w_8fad4d2
083839353.jpg,w_0b1e4a6 new_whale w_68eaf36 w_fa2ec89 w_28a16b0
08398f5f3.jpg,w_343f088 new_whale w_e74475b w_76065ea w_7c82391
08461a7bd.jpg,w_2ab34d0 new_whale w_b3afb40 w_5d426b6 w_acbedef
085519e04.jpg,w_a9304b9 new_whale w_966b510 w_1efbb8e w_2aaa3b5
0885f9f70.jpg,w_a95c680 new_whale w_a8a52de w_e4b4611 w_8cfabed
0894d33d2.jpg,new_whale w_91ed407 w_b99f945 w_a6a732d w_7c1435e
089d89af8.jpg,new_whale w_b9c99cc w_3b71107 w_af367c3 w_e1ffbe2
089ea7ad4.jpg,w_d8cb231 new_whale w_2b49489 w_20eeb29 w_ac33bfe
08a9d7464.jpg,new_whale w_3216236 w_1ca9ab1 w_68eaf36 w_ea902fb
08ad4b867.jpg,w_662530e new_whale w_d6f0be4 w_6f7611c w_ff2157c
08ad8c606.jpg,w_2211e6d new_whale w_f119baa w_63d6920 w_009c9c5
08af2949e.jpg,w_1f1cee1 new_whale w_bb2cbcf w_0c69117 w_3250a08
08d90d7c4.jpg,new_whale w_a8fcebc w_bfed9c6 w_90a2cf7 w_a33ed90
08eaeb761.jpg,new_whale w_9b89c88 w_d066f46 w_2d0cfc1 w_b805777
08f84d436.jpg,w_05d65b9 w_e06d673 new_whale w_19410fe w_b9cfccb
08f85605f.jpg,w_e2372d6 w_9227ca2 new_whale w_ae19ff0 w_8a35001
08f9703c2.jpg,new_whale w_45246db w_4a01f24 w_f6524e1 w_14330a0
08fe4393c.jpg,w_a6703dd new_whale w_d0475b2 w_dc651ad w_2b65b34
08fea2581.jpg,w_1788910 new_whale w_985d205 w_4ff2f4a w_f7cb97d
0901ea8df.jpg,w_b3196aa new_whale w_5a63294 w_8e88f4f w_5821157
090697c46.jpg,w_025911c new_whale w_b4396ae w_02d138d w_ae393cd
09083e03b.jpg,w_b3cde16 new_whale w_df1f698 w_c6a96e1 w_59052ad
091995bde.jpg,new_whale w_9bd2794 w_e906edd w_f86b16b w_1032bb6
091a88443.jpg,w_dd88965 new_whale w_3c8f7da w_e0cf908 w_cc1784d
09232fe8c.jpg,w_90c9763 new_whale w_16def42 w_6a95be3 w_b7aa4d8
09243b84a.jpg,w_f08fb81 new_whale w_4d7df64 w_9be951c w_f35e494
092947f89.jpg,w_f2dd08f w_8fb247e w_ae19ff0 w_5303b20 w_a31ead9
0935551a1.jpg,new_whale w_470be90 w_d066f46 w_7c82391 w_0bf90d9
093e965a3.jpg,w_343f088 new_whale w_9e52d87 w_08c7d09 w_4fdb4c1
0941de387.jpg,w_b3197c6 new_whale w_776f336 w_deda5f7 w_985d205
094d2354f.jpg,new_whale w_4e13e82 w_e5978cf w_334c489 w_971d191
0956ac81e.jpg,w_186d294 new_whale w_4dac709 w_bfcad53 w_b3cde16
095b5dc09.jpg,w_dd944b7 new_whale w_98f2705 w_bc285a6 w_d602efb
095ce0289.jpg,w_eba33fb new_whale w_20950a9 w_12cc52d w_0fdf741
09629641e.jpg,w_36b8101 new_whale w_a13c09d w_faad3f8 w_1995d15
09685092f.jpg,w_87e5b68 new_whale w_ba4f96c w_c190aa8 w_0887d9b
0969f46de.jpg,w_6e999b0 new_whale w_71ed685 w_2623921 w_4d06559
096e5b78c.jpg,w_16b5050 new_whale w_3278209 w_50fd107 w_de657c1
097fdfbea.jpg,w_0bc078c new_whale w_df86a42 w_22d96e7 w_480d478
097ffdb27.jpg,new_whale w_0cbf1b3 w_8b647d4 w_78e7020 w_8507818
0982ee2f3.jpg,w_c2397a4 new_whale w_dea042e w_79843ce w_3c80f07
09897a498.jpg,w_2f8895a new_whale w_45246db w_7b098ce w_acbedef
098cf81eb.jpg,w_b8a7ee7 new_whale w_d15dd0b w_234713b w_659bdb8
0990e61d9.jpg,new_whale w_23ce00e w_91037a7 w_076bb5a w_0a0c768
09a17739b.jpg,w_2645f4d new_whale w_2b4b82e w_04d4568 w_e11afff
09ae7a1c4.jpg,new_whale w_c01c1f4 w_efe3a39 w_26db444 w_96985c1
09b7aab77.jpg,w_8c25681 w_6822dbc new_whale w_659bdb8 w_fbcfe74
09bcfb6d9.jpg,w_6bab2bd w_ffa542b new_whale w_7547b9a w_267c7e3
09c1449a2.jpg,w_73435d0 new_whale w_3c8f7da w_50e8d58 w_2f67f0a
09ce1acbc.jpg,new_whale w_11bd416 w_1289b63 w_4f9c015 w_3476b19
09cf7a61a.jpg,w_b2bc0c9 new_whale w_659bdb8 w_ec7e60a w_28589bc
09e06b4c6.jpg,w_ebdc496 new_whale w_4d06559 w_e022d1b w_357617e
09f1cd66d.jpg,new_whale w_e1c5b57 w_e20dcb5 w_fd3e556 w_43fa7fc
09f3b8b7f.jpg,w_21bb5bd new_whale w_625e590 w_ec4bcf9 w_0e1eccb
09f64102b.jpg,w_c536a4a w_a8b34a0 new_whale w_99b7ba2 w_26c0ffd
0a0ec5a23.jpg,w_b9d5945 new_whale w_1be76f5 w_186d294 w_ad6df15
0a1785dc6.jpg,w_f8b4ea9 new_whale w_a6d6964 w_0292e15 w_03670aa
0a17925d7.jpg,w_090c801 new_whale w_2b50adf w_ea902fb w_0abdaf4
0a17a66ea.jpg,w_ea902fb new_whale w_1ccea93 w_1b7eaad w_e1f57e7
0a17df049.jpg,w_49cd60d new_whale w_066ddc5 w_0f0f15c w_0b398b2
0a1890899.jpg,new_whale w_28c1ced w_1834b49 w_1b0c4b7 w_b6ad668
0a21bfb1a.jpg,w_f71de1c new_whale w_d405854 w_ef83760 w_4fadedd
0a2a6904f.jpg,w_98f2705 new_whale w_e73d9a5 w_e1f57e7 w_87b0e69
0a3b8a8e8.jpg,w_fc6dd24 new_whale w_659bdb8 w_b9d5945 w_234713b
0a3f2415f.jpg,w_4ff2f4a w_8a7071c new_whale w_16a13bb w_4135cb8
0a437f4f8.jpg,w_0f56fb2 new_whale w_75d0e61 w_fc6dd24 w_3815890
0a5be3b4c.jpg,new_whale w_c2397a4 w_b8b8383 w_6ca0970 w_d24c654
0a6231824.jpg,new_whale w_396c07d w_b5e13cd w_6cfa650 w_4c62681
0a78e8c21.jpg,w_28c1ced new_whale w_814a1cc w_f353d20 w_67a9841
0a7c3ab7e.jpg,new_whale w_334c489 w_9b5d7b1 w_e04d084 w_32de0c5
0a810e2a1.jpg,w_2b65b34 new_whale w_7b989fb w_8c8f8b6 w_22d96e7
0a8c32aa2.jpg,w_cb0aaf0 w_954fec8 new_whale w_2d0cfc1 w_659bdb8
0a8daaa8c.jpg,w_c97ad94 new_whale w_4888003 w_b938e96 w_6cda039
0a8e58929.jpg,w_538259a new_whale w_62c78f3 w_d5d111d w_c5e1472
0a946e283.jpg,new_whale w_c27ee06 w_2362d7f w_6339d14 w_022b708
0a9b3c0dc.jpg,w_ab2ac77 new_whale w_0abdaf4 w_30f2f0f w_ea05006
0a9f76baa.jpg,w_4cf5e29 new_whale w_9cf0388 w_3bf2653 w_5665c80
0aa099dec.jpg,w_8f4d879 w_a6eaf8d new_whale w_95b8b64 w_92a47eb
0aa16aa26.jpg,new_whale w_f57140c w_a113b33 w_06376db w_753d66c
0aa2615d0.jpg,w_9472e22 new_whale w_3499014 w_d4c24e6 w_3b71107
0aa98293e.jpg,w_1f7c696 new_whale w_99af1a9 w_df1f698 w_051764c
0aaa29830.jpg,w_9ddb645 new_whale w_2211e6d w_9eb2d2a w_1ff111d
0ab754aff.jpg,new_whale w_f24a55c w_a074110 w_80bb6c7 w_e1f57e7
0acdb56da.jpg,new_whale w_08630fd w_7ffc63c w_5ff2049 w_13c1b55
0ad02b007.jpg,w_334c489 w_37d2f3a new_whale w_2645f4d w_f1b6eea
0ad5c7959.jpg,w_78fbecd new_whale w_b805777 w_c2677ee w_31438a5
0ade78f0b.jpg,w_d066f46 new_whale w_c2397a4 w_71df35a w_12e7c23
0ae8027fa.jpg,w_352445a new_whale w_06ffb30 w_260a2e7 w_3155d04
0aeb3fd4f.jpg,w_2f1488c new_whale w_6f3a3ec w_06d2e72 w_21bb5bd
0aec113b3.jpg,new_whale w_51a0ec9 w_46a38a6 w_bafb1e8 w_d8a08f8
0b0628ce5.jpg,new_whale w_1289b63 w_bef0a5d w_b7dbec2 w_ab2ac77
0b1619e1c.jpg,w_13aa123 new_whale w_4ff2f4a w_e9b4719 w_b4fe6b0
0b3372f01.jpg,w_56fcc39 new_whale w_6f7611c w_5f5f9ae w_83d10c1
0b4ac2b0a.jpg,w_df1f698 new_whale w_2c0cfe8 w_58d3dd3 w_2964e0b
0b4b8858e.jpg,new_whale w_ea05006 w_88b3a3d w_7547b9a w_446a02d
0b55a9127.jpg,w_470be90 w_fa11a3f w_4d7df64 new_whale w_3f0fd95
0b6f58d39.jpg,w_3384715 new_whale w_8d76b75 w_f1b6eea w_27a6304
0b764f19d.jpg,w_5665c80 new_whale w_298a035 w_3f6f934 w_b7b1472
0b7ecaa3d.jpg,w_5597026 new_whale w_b57a7be w_32838db w_51a0ec9
0b833edd3.jpg,w_ef83760 new_whale w_dd944b7 w_714f89f w_927f345
0b9520529.jpg,w_6cfa650 w_0b1e4a6 w_bd1c3d5 new_whale w_4460861
0b9b6b8ef.jpg,new_whale w_640a24a w_4132bb8 w_bfd6858 w_265ac62
0ba0e9fad.jpg,w_71a1a08 w_059d9e0 new_whale w_0027efa w_52cd115
0bba89813.jpg,w_45473b9 new_whale w_9490369 w_26ba5fd w_564a34b
0bce07b3c.jpg,new_whale w_69a58b2 w_6823268 w_c92d4a9 w_3879fa0
0bcf9ce11.jpg,w_446a02d new_whale w_8003858 w_6cfa650 w_c2a1bc4
0bee2732b.jpg,new_whale w_32da935 w_e06d673 w_3fe2251 w_61b9586
0bf02efd4.jpg,new_whale w_55a34c7 w_d94fa7a w_26ba5fd w_2af46a8
0bf807cca.jpg,w_065ee1b new_whale w_27597ff w_cc1784d w_472b51c
0bf8f6746.jpg,new_whale w_e2b0292 w_b99f945 w_7707132 w_21666ad
0bfd71606.jpg,w_db0c7fd new_whale w_fa955f1 w_470be90 w_611d18b
0bff72486.jpg,w_3ebfe7a new_whale w_58afeb2 w_ff1de02 w_22d96e7
0c0277706.jpg,w_c97ad94 w_96c35cc new_whale w_eeea781 w_f892ca8
0c0775b6e.jpg,w_04d4568 new_whale w_8e88f4f w_89f6097 w_bc285a6
0c0918b12.jpg,w_68eaf36 new_whale w_3b71107 w_efa100e w_3aa8e97
0c1f975f3.jpg,w_2ed0d2f new_whale w_5793f1c w_b7c9e1e w_8d76b75
0c2522fbd.jpg,new_whale w_e36fb17 w_0135f5f w_9614e63 w_e1ffbe2
0c2d0b8b8.jpg,w_20eeb29 new_whale w_2b49489 w_d8cb231 w_8f4d879
0c3379921.jpg,w_b938e96 new_whale w_7a91862 w_33696ac w_bd1c3d5
0c3b20b58.jpg,w_fbc7895 w_ae32f8b new_whale w_23e1d57 w_5e8e218
0c41f6aff.jpg,new_whale w_dcbdd01 w_416168a w_0888e56 w_d066c0a
0c490c283.jpg,new_whale w_94f41dc w_a053e56 w_591a2c5 w_8f2943e
0c533e95a.jpg,w_3c972b3 new_whale w_a9304b9 w_a87ec7e w_9d56f22
0c8c3b13d.jpg,w_8e88f4f w_8ad632d w_fccac74 new_whale w_e8ab3c8
0c9203352.jpg,w_6822dbc new_whale w_20dfb69 w_fec331a w_33696ac
0c9392543.jpg,new_whale w_e9b4719 w_99e43ae w_3207433 w_9f13096
0c949b8f3.jpg,w_c4862bb new_whale w_c8e2df4 w_dced3f2 w_492d9c5
0c9928e81.jpg,w_e897a60 new_whale w_470be90 w_688590b w_dcee281
0c99493b7.jpg,w_1217536 w_4516ff1 new_whale w_c959cae w_4b5ade3
