Image,Id
81ce60133.jpg,w_80a59e6 w_2d1592c new_whale w_5babd8c w_aeabde9
81d038bdd.jpg,w_cd99382 new_whale w_f77e282 w_1e1e5d9 w_789c969
81ec3d996.jpg,w_f0fe284 new_whale w_98f2705 w_a053ed9 w_38de45d
81f5f2a08.jpg,w_cc1784d new_whale w_8e88f4f w_7aea0b8 w_31b5dd8
81f8b5140.jpg,w_6cfa650 new_whale w_ca11f46 w_7648ac1 w_53ce2e1
81f9fa3d9.jpg,new_whale w_2f8de4f w_61e4690 w_efa100e w_394f053
81fc4ae42.jpg,w_5793f1c new_whale w_6e6307e w_1f7c696 w_c509e1e
81fe37eaf.jpg,w_46ccc6f new_whale w_8dcdb19 w_c4232a3 w_e069b6a
82043d011.jpg,new_whale w_06935ed w_5665c80 w_05d65b9 w_e06d673
8206ef622.jpg,w_367fb60 new_whale w_9c68fe8 w_3976c05 w_62fc862
8209efad7.jpg,new_whale w_bb2cbcf w_df1f698 w_3224f68 w_38de45d
821414738.jpg,new_whale w_e5b21c0 w_cc1784d w_0da34d3 w_b4396ae
82221a701.jpg,w_bd18f3c new_whale w_c734fa4 w_28c330c w_fbc7895
8232c4a99.jpg,w_f1b6eea new_whale w_5801869 w_f70c302 w_971d191
824234b8d.jpg,w_e8ab3c8 w_70e9661 new_whale w_5fcf350 w_f50b00d
8246175c1.jpg,w_653099f new_whale w_77c86af w_bd1c3d5 w_6823268
824eddb77.jpg,w_f61b957 new_whale w_f459442 w_26c0ffd w_5d5c6a6
8266824a7.jpg,new_whale w_910831a w_a70b90b w_a33b6d6 w_966b510
8266c1af5.jpg,w_81d1ff9 w_144ecb6 new_whale w_2645f4d w_fccac74
826d7ccae.jpg,new_whale w_da011a1 w_c7e1b12 w_bcb2fe3 w_2009f8b
829108d61.jpg,new_whale w_43312c4 w_ee2a1e0 w_8be0240 w_bb9497e
829dfd951.jpg,w_e9b4719 new_whale w_3309cbd w_a79e00d w_3bf2653
82a501c48.jpg,w_b953028 new_whale w_9b5d7b1 w_afb4a42 w_22f46ab
82bb38b0f.jpg,w_2694603 new_whale w_c4862bb w_9fe60cd w_3f78360
82be2beb9.jpg,w_29af733 new_whale w_6579856 w_4690940 w_274d994
82cc99533.jpg,w_a5f74b2 w_c9cf75d w_efa100e new_whale w_5d5c6a6
82d1fbb53.jpg,w_fd6a3ad new_whale w_f3a12bc w_e4d326a w_8d0a2a2
82d75a6bf.jpg,w_588f349 w_f408b56 new_whale w_066ddc5 w_8ca7f37
82d8acaa0.jpg,w_68eaf36 w_3b71107 w_fd3e556 w_b48ce14 w_205708f
82e18b2e1.jpg,w_88b3466 w_db68456 new_whale w_28c330c w_ca66b79
82f25e1b8.jpg,w_5e8e218 new_whale w_faac069 w_e906edd w_efe3a39
82f45e027.jpg,new_whale w_67a9841 w_1efbb8e w_dd80742 w_270f505
82fd46309.jpg,new_whale w_51fe22f w_6cfa650 w_955bfe2 w_fd3e556
83033395f.jpg,w_1419d90 w_22d96e7 new_whale w_0cbf1b3 w_58d8bbd
8311497a3.jpg,new_whale w_b57a7be w_5ed2a38 w_6cb656d w_8a56270
831607584.jpg,new_whale w_e6dfc39 w_d0475b2 w_789c969 w_94f41dc
8317aa4d6.jpg,w_bef2a3f w_21bb5bd w_cdf834e new_whale w_fa955f1
8335d942b.jpg,new_whale w_dd837b1 w_7d44896 w_4bf625b w_f9aab0c
833f7dcf0.jpg,w_8f0c6ed w_659bdb8 w_066ddc5 new_whale w_9eb2d2a
834023841.jpg,new_whale w_3d56b7c w_4846b27 w_a05181b w_639867f
83455070d.jpg,new_whale w_41429ea w_0f56fb2 w_480d478 w_da16ee8
835936c9f.jpg,new_whale w_0ee7878 w_f13f7b3 w_43f0465 w_db2d2ac
83608e898.jpg,new_whale w_19671ad w_ab2ac77 w_6d8f72e w_ef83760
838257d43.jpg,w_f1d2902 new_whale w_fdd3687 w_6189444 w_3e4b155
8392ed906.jpg,w_2c0cfe8 w_6fce84d new_whale w_4e88955 w_34941d8
83a5aa086.jpg,new_whale w_90c9763 w_a074110 w_94e136e w_1e283bb
83b2a8a76.jpg,w_cb0aaf0 new_whale w_c2397a4 w_620dffe w_d0bf381
83b9f5fba.jpg,w_f2075ef new_whale w_1995d15 w_e6faba8 w_d01f587
83ba3a456.jpg,new_whale w_4b5ade3 w_46796cc w_051764c w_e33e588
83ccbb7ff.jpg,w_5ed2a38 new_whale w_8a56270 w_e2372d6 w_29af733
83dcc971e.jpg,w_9634512 new_whale w_d066f46 w_935a516 w_8b1f4be
83e78e6b3.jpg,w_85923bb new_whale w_0f56fb2 w_c4862bb w_cb50f6e
83f7bd99b.jpg,w_67b3af9 w_d71a790 new_whale w_b48ce14 w_c01c1f4
83fc463f2.jpg,new_whale w_b8a02a2 w_7e56d66 w_835a1eb w_b495218
84092b852.jpg,w_8a1786f new_whale w_cef693e w_43614bc w_8340caf
841b05f1b.jpg,w_22d96e7 w_47098f8 new_whale w_6c3ec2d w_2e9ed59
841c4aa3c.jpg,w_1920193 new_whale w_e5ab551 w_8f38839 w_f6eed29
841dde4bb.jpg,new_whale w_d945006 w_4bf625b w_e897a60 w_f2075ef
842431903.jpg,w_0833a92 new_whale w_e2c24d2 w_242fb46 w_ddf876d
8427f51a8.jpg,w_a3181a0 new_whale w_302799d w_20dfb69 w_6822dbc
8434d0f01.jpg,w_b938e96 new_whale w_83e0076 w_9884e90 w_a113b33
8437fe93d.jpg,w_234713b new_whale w_57abc0f w_564a34b w_2623921
843c0388c.jpg,w_c6b4d61 new_whale w_68eaf36 w_f497e3f w_21bb5bd
844d990c6.jpg,w_625e590 w_60ce6fc new_whale w_6822dbc w_ad3a043
844ff5934.jpg,w_61b9586 new_whale w_0baf946 w_cefd512 w_8507818
8452213fa.jpg,w_40a8585 new_whale w_b71ac68 w_5babd8c w_cbb15d2
8455a7494.jpg,w_d066f46 new_whale w_df1f698 w_3bd976e w_e5ab551
845806ee8.jpg,w_ac51301 new_whale w_f765256 w_59088ff w_26c0ffd
846add659.jpg,w_45246db new_whale w_5e8e218 w_c2a1bc4 w_f74a89e
846b7ef68.jpg,w_286d2cc w_4441671 new_whale w_1b5b199 w_10bb1ba
84715ff10.jpg,w_0baf946 new_whale w_da011a1 w_50e8d58 w_8003858
8472b638b.jpg,w_53feb91 new_whale w_32da935 w_f1ec429 w_e4a9205
8473b9c07.jpg,w_84f9ab0 new_whale w_fd3e556 w_d7b6f17 w_94a7669
847607dfb.jpg,w_f437f82 new_whale w_e8c5ff0 w_1531bf5 w_6cfa650
847aedbb4.jpg,w_6525e6b new_whale w_fe95c92 w_d588ecb w_6f9f759
847d7bbba.jpg,w_0135f5f new_whale w_4c62681 w_e1ffbe2 w_f765256
847fda2fa.jpg,new_whale w_8a1786f w_eaa5dbb w_286d2cc w_88b981e
848389d4b.jpg,w_0da34d3 new_whale w_6bab2bd w_dea40e2 w_7c60e77
8488b43c2.jpg,w_101990d w_3a34d6f new_whale w_8c959a6 w_4fdb4c1
84899b716.jpg,w_6e0a45b new_whale w_714f89f w_a074110 w_5f5f9ae
848a79466.jpg,w_43f3361 new_whale w_a13f1d0 w_8c959a6 w_a71d6bf
8497ea339.jpg,w_2e5ad54 new_whale w_3e979c0 w_ad3a043 w_5037cfd
849d55148.jpg,w_ad343a6 w_5b463cf new_whale w_4441671 w_731fe92
84b6d8d81.jpg,w_0b1e4a6 new_whale w_3ec7fa2 w_2f8de4f w_f7702cd
84c2660b6.jpg,new_whale w_118a4a4 w_89f6097 w_072f593 w_b44e89d
84c30aaf7.jpg,w_0e9f07a new_whale w_1ecca2d w_faf5287 w_036bc54
84c7baa82.jpg,new_whale w_888391a w_11ff425 w_f70c302 w_455bc02
84d5717eb.jpg,w_6822dbc new_whale w_99e43ae w_972e51e w_625e590
84d5dcb9b.jpg,new_whale w_0cbf1b3 w_ddf876d w_ccf3551 w_ce44322
84d906f35.jpg,w_1ca9ab1 new_whale w_f3a12bc w_73d71d2 w_b8a7ee7
84dab8724.jpg,w_e1c5b57 new_whale w_6822dbc w_8f424c5 w_0350bf4
84e539fe3.jpg,w_836e895 new_whale w_234713b w_5d06edd w_b3cc7b3
84e7fcaaa.jpg,w_a2158b8 new_whale w_8d33cf5 w_218fe4a w_b9d732d
84e9b831b.jpg,new_whale w_b9e5911 w_190375b w_c6fe966 w_bda67e7
84f5823c7.jpg,w_af367c3 new_whale w_9d86594 w_e4ed810 w_88b3466
85143cf43.jpg,w_60f11fb new_whale w_b805777 w_f6a16aa w_c4862bb
851af8580.jpg,w_2d1592c new_whale w_396c07d w_59915b1 w_13aa123
8520b9505.jpg,w_6cfa650 w_a6a1bea new_whale w_efe3a39 w_4ab3420
852eebf2c.jpg,w_68ed1f9 new_whale w_af520bd w_e8c5ff0 w_c073f96
8534e36e4.jpg,w_63f5740 new_whale w_1995d15 w_5821157 w_d01f587
853b84f71.jpg,w_f0fe284 new_whale w_789c969 w_627187b w_5821157
8544e24b1.jpg,w_8e88f4f new_whale w_16def42 w_894296c w_91cdea4
854b1ebef.jpg,w_51e0e04 new_whale w_20dfb69 w_7342df0 w_45246db
854c2e823.jpg,w_f765256 w_6cfa650 new_whale w_0027efa w_2b069ba
85580d6a1.jpg,w_fa2ec89 new_whale w_bd26110 w_2f1488c w_08d62ee
855ddc515.jpg,w_d1b3a00 new_whale w_6579856 w_03e3e5e w_2fec5ea
8565afbd6.jpg,w_8a7071c new_whale w_0887d9b w_4d06559 w_02aa597
8566b12d3.jpg,new_whale w_88aca21 w_3ec7fa2 w_54ea24d w_807f02e
8566e813c.jpg,new_whale w_17ba5e4 w_ecd734e w_b1a3345 w_1ccd2a1
8579eb3d1.jpg,new_whale w_1e286e0 w_c89981f w_fd6a3ad w_50e8d58
857e9dcab.jpg,new_whale w_b9e5911 w_b938e96 w_d3332dc w_1275240
8587f0ef2.jpg,w_fccccec new_whale w_da011a1 w_76ad1d2 w_f793b1f
859af97a6.jpg,new_whale w_f48451c w_d066c0a w_3879fa0 w_51e7506
859d7e49d.jpg,w_e1c5b57 new_whale w_60b027a w_59915b1 w_7ff9682
859f00285.jpg,w_1032bb6 w_3b71107 new_whale w_7d6527e w_c158581
85a5c9507.jpg,w_68eaf36 new_whale w_d980663 w_1de6148 w_23e1d57
85a60d11a.jpg,new_whale w_d236b51 w_ab7c369 w_0a8d318 w_3eae264
85b4b76da.jpg,w_653dde1 new_whale w_659bdb8 w_f765256 w_2f6d4a8
85b822ecb.jpg,w_27be996 w_12aae3e new_whale w_62fc862 w_ac97190
85cfab706.jpg,w_ed1df50 new_whale w_82e5785 w_dcee281 w_c9fbac4
85d4af670.jpg,w_b805777 new_whale w_2fec5ea w_6579856 w_5e5fec6
85d6ab933.jpg,w_decafbd new_whale w_6e0a45b w_bb08804 w_066ac1a
85dac9edf.jpg,w_c7e2a65 new_whale w_bc285a6 w_ed50c26 w_102e715
85deba351.jpg,w_778e474 w_df1f698 new_whale w_671b041 w_1faaf06
85e4d3922.jpg,w_3feca90 w_b210a87 new_whale w_1d532b4 w_b1a3345
85e7d5321.jpg,w_9438119 new_whale w_88065f2 w_bd18f3c w_f1b6eea
85ebfd8b8.jpg,w_ea7bc89 new_whale w_003bae6 w_ecb61a0 w_6cda039
85fa8ce46.jpg,w_4441671 new_whale w_b9d732d w_44479bb w_1728040
85ff27c6b.jpg,w_99e43ae new_whale w_08d62ee w_4dfeafc w_80124ae
860cc703b.jpg,new_whale w_9340ca3 w_fbcfe1a w_8e3a722 w_cc1784d
8614122aa.jpg,new_whale w_ac26398 w_6d8f72e w_b0cadc0 w_5e94510
861ae8e0e.jpg,new_whale w_5816f86 w_ac26398 w_f74a89e w_34d7623
861c0e54e.jpg,new_whale w_0277a07 w_f8bb266 w_b99f945 w_c7e1b12
861e6c332.jpg,new_whale w_00904a7 w_f8dc1cc w_ec1eb03 w_efc261b
863b6e6fb.jpg,w_ebdc496 w_6c3ec2d w_b5c3634 new_whale w_778e474
8658bfffc.jpg,w_80b474e w_f829227 w_68eaf36 new_whale w_efa100e
865ad6b17.jpg,w_ae19ff0 new_whale w_88065f2 w_8ad2534 w_4441671
865bb5f27.jpg,w_c8bbb43 new_whale w_c7bd8e7 w_c2de607 w_3904b99
866c45338.jpg,new_whale w_47996c6 w_8c8f8b6 w_5a49beb w_b003eb0
866f92b2d.jpg,new_whale w_d869993 w_1f8c439 w_396c12b w_615a631
8670262ea.jpg,w_aaf3463 w_c59d4b1 new_whale w_2a946f2 w_518a722
86763556c.jpg,w_79843ce new_whale w_23a388d w_36f2ebb w_0bb9927
867703d75.jpg,w_bf2b915 new_whale w_8a1786f w_80acb6f w_0718183
867eedf36.jpg,w_4441671 new_whale w_bb56867 w_c1bab16 w_2f94559
8685ae517.jpg,w_11ff425 new_whale w_888391a w_5cf4727 w_ae8982d
86934f4c8.jpg,w_06d2e72 new_whale w_4ff2f4a w_2f1488c w_1ff111d
8694c9d9f.jpg,w_efa6b4a w_c55c51d new_whale w_36f2ebb w_7d8c37c
869fce8c8.jpg,w_e906edd new_whale w_e71f9c7 w_5e8e218 w_46c4c49
86a174149.jpg,w_b953028 new_whale w_8a1786f w_729290b w_99e43ae
86a1b2d8e.jpg,w_fd3e556 new_whale w_6cfa650 w_68eaf36 w_c200e52
86a1e4ad4.jpg,w_7b41bf7 new_whale w_a9304b9 w_f829227 w_04003e9
86a365247.jpg,w_056710d new_whale w_e2b0292 w_91cc02c w_e906edd
86a79254b.jpg,w_5d5c6a6 new_whale w_009c9c5 w_18c481a w_04003e9
86bdbaa57.jpg,new_whale w_102e715 w_a0f456b w_fccac74 w_df1f698
86be3cb18.jpg,new_whale w_cdd2642 w_db68456 w_4bf625b w_6525e6b
86d1c8773.jpg,w_3bb142c new_whale w_243b654 w_a68bac6 w_52a5d92
86d6bbd3c.jpg,w_db68456 new_whale w_990921b w_bbfce38 w_df1f698
86d8eb844.jpg,new_whale w_1c6465a w_e2372d6 w_8bcc197 w_fe94155
86e1f739d.jpg,w_bc62c27 new_whale w_8443156 w_90c9763 w_f128a4d
86e79d706.jpg,new_whale w_4b815d3 w_ec4bcf9 w_2d0cfc1 w_da011a1
86e958657.jpg,w_361a865 new_whale w_a4162d6 w_5ed2a38 w_cf5d69c
86fa93cd9.jpg,w_72fea5e new_whale w_653099f w_218fe4a w_4dcdda3
86faae6a6.jpg,w_ed1df50 new_whale w_6bab2bd w_fdcaaa8 w_b9d732d
86fddfb1c.jpg,new_whale w_535448f w_6c0cdb1 w_02d5c46 w_dcee281
870d0d781.jpg,w_19410fe w_b5c3634 new_whale w_bc28a13 w_0888e56
870d71bbe.jpg,w_a08f3cd new_whale w_da5b8fe w_ab44c81 w_07cc9c2
8725fac4e.jpg,w_3384715 new_whale w_e12b78d w_a190a88 w_eaa5dbb
87347ea97.jpg,new_whale w_327175f w_aa3489d w_d3e5689 w_8a1786f
8749f0fef.jpg,w_84b255f new_whale w_074530d w_6579856 w_377ef2c
8754ab227.jpg,new_whale w_2b4b82e w_c684a38 w_101990d w_aeabde9
8758e4445.jpg,new_whale w_eec42d0 w_817d53c w_2efa6ab w_cc1784d
87597ba50.jpg,w_cc1784d new_whale w_30f2f0f w_9697236 w_3ff114c
876960e28.jpg,new_whale w_72f5c64 w_214e081 w_45246db w_a335fc2
876dbab7b.jpg,w_065ee1b w_6dbfd7a new_whale w_310226c w_68aa903
8772b8fdc.jpg,w_e486063 new_whale w_8e88f4f w_0369a5c w_700ebb4
8776b5948.jpg,new_whale w_2b4b82e w_a8b34a0 w_ddf876d w_14330a0
8778aef93.jpg,new_whale w_f2075ef w_7a61cb2 w_9f02ca1 w_4f9c015
8786bec0d.jpg,w_ecd734e new_whale w_0637181 w_c2c20eb w_a26cf66
87873f805.jpg,w_9be951c new_whale w_ea05006 w_ce8aa12 w_9fe60cd
878a9df5d.jpg,w_787af6b new_whale w_2f8de4f w_e0cf908 w_540ac0a
8790ac3d2.jpg,w_1e85eea new_whale w_a9304b9 w_1efbb8e w_611d18b
8790b16b9.jpg,w_8b647d4 w_659bdb8 new_whale w_614b549 w_46796cc
879370ff2.jpg,w_faac069 new_whale w_e4a9205 w_d0fd41c w_e71f9c7
87aaa993e.jpg,w_5946cd1 new_whale w_0bfdcca w_c1715f5 w_2972f31
87aabbd5b.jpg,w_22d96e7 new_whale w_aa0dacc w_fa2ec89 w_1666216
87b11af7d.jpg,w_5e8e218 new_whale w_b2e75dc w_26db444 w_edf0164
87c3b2750.jpg,w_fbcfe74 new_whale w_12e8dc7 w_659bdb8 w_4b815d3
87cebbeec.jpg,w_faf5287 new_whale w_bd4e5dd w_fec331a w_d7aad03
87db1105b.jpg,w_2b49489 new_whale w_ac33bfe w_dd80742 w_d8cb231
87ee37cfa.jpg,w_7d458aa new_whale w_84a32d1 w_5d1b1a7 w_21f1129
87f47de5f.jpg,new_whale w_8f4d879 w_26301f8 w_11bd416 w_32043b0
87f92050d.jpg,w_871decc w_bdded04 w_df27de9 new_whale w_4c07458
8809a5aa0.jpg,w_6822dbc new_whale w_48aa237 w_090c801 w_d7aad03
881b56571.jpg,w_9297b97 new_whale w_6cfa650 w_fa2ec89 w_9544084
8826ff3a4.jpg,w_470be90 new_whale w_e2372d6 w_6579856 w_358c519
882c07680.jpg,w_fa2ec89 new_whale w_be4f189 w_9297b97 w_28589bc
882ca0708.jpg,new_whale w_874b395 w_8739af5 w_b21cfe4 w_b9d5945
883f79d02.jpg,w_c058057 new_whale w_2645f4d w_4182dba w_208db25
8843b117c.jpg,new_whale w_98f2705 w_a8fcebc w_ddf876d w_3c8f7da
88495a329.jpg,w_afcf807 new_whale w_d3baa35 w_dd944b7 w_b3cde16
8852b08b7.jpg,new_whale w_218fe4a w_ff2157c w_4214909 w_553d1ef
885f13fa5.jpg,new_whale w_066ddc5 w_8d9af77 w_34120de w_fdfd867
885f44328.jpg,new_whale w_ba77e9c w_75b6e81 w_ea7bc89 w_7c27fbd
886403bf2.jpg,w_cd4cb49 new_whale w_c896384 w_9ba4a9a w_2df37cc
886b500bc.jpg,w_08630fd new_whale w_df1f698 w_59052ad w_990921b
88708cae6.jpg,w_b8a7ee7 new_whale w_57db059 w_234d686 w_f437f82
887ef0fd0.jpg,w_1f1cee1 new_whale w_9c506f6 w_0027efa w_bff3c3b
888d15904.jpg,new_whale w_25183b8 w_f70c302 w_32eaf54 w_dd837b1
8890736be.jpg,new_whale w_9438119 w_6bab2bd w_5b463cf w_8103832
889e02582.jpg,w_8cee3d3 new_whale w_5303b20 w_c058057 w_86726bc
88a432319.jpg,w_d0728b9 w_b805777 new_whale w_6822dbc w_260ff2c
88a5f6f7e.jpg,w_4dac709 new_whale w_a26cf66 w_022b708 w_653099f
88ab63c4d.jpg,new_whale w_2d5b0e1 w_9340ca3 w_2a7603f w_57db059
88b01bae2.jpg,w_334c489 new_whale w_f1b6eea w_16df050 w_1260eb5
88beac33a.jpg,w_4441671 new_whale w_3716cec w_72f3685 w_2972f31
88c230b0e.jpg,w_61e4690 new_whale w_242fb46 w_f70c302 w_7e2eb3d
88c2f408a.jpg,new_whale w_ac910d6 w_15805cd w_20c0bc0 w_cfae8d8
88c631f9a.jpg,new_whale w_d287825 w_b4a7cd2 w_e2372d6 w_8bcc197
88cd7e386.jpg,w_22d96e7 w_ddf876d new_whale w_5793f1c w_00b3dc2
88dfa5379.jpg,w_c4faf7d new_whale w_2e1416e w_68eaf36 w_62ecd30
88f89575e.jpg,w_faf5287 w_42e0e40 new_whale w_82e7319 w_066ddc5
8900e3f78.jpg,new_whale w_6d8b67b w_dc97eed w_17a3a21 w_c650f39
8904436bf.jpg,w_e51c0e9 new_whale w_d1b3a00 w_13937e4 w_3de579a
891456c3c.jpg,w_6b2ecc8 new_whale w_03670aa w_51fc1fc w_cda3971
891c3f447.jpg,w_939423d new_whale w_c815410 w_4f6b509 w_78ab4d4
89209c1cf.jpg,w_01f14e1 new_whale w_d853d93 w_b403feb w_8a1786f
89329c701.jpg,new_whale w_7a8ce16 w_89a0473 w_bfae26b w_e12b78d
8940c9ccb.jpg,w_e918d4c new_whale w_8dcdb19 w_2f67f0a w_6bab2bd
8945e4629.jpg,w_c2a1bc4 new_whale w_c1d2fbe w_17a3a21 w_581ba42
89480c6ab.jpg,w_ae8982d new_whale w_16def42 w_6b25530 w_2d6596f
894db4115.jpg,w_8e88f4f new_whale w_97f4b38 w_4dcdda3 w_4e33dc8
894f9b9b5.jpg,w_bfe77d0 new_whale w_85d9229 w_1f429ff w_2623921
8952a257e.jpg,w_3de579a new_whale w_d066f46 w_51fc1fc w_c058057
895ea772c.jpg,w_34ecf36 new_whale w_5babd8c w_58d8bbd w_05b4b0c
8960e07e4.jpg,new_whale w_3cc4623 w_6ebfe7b w_fa2ec89 w_0aed03f
896ba6c8e.jpg,w_6dbfd7a new_whale w_cd4cb49 w_0369a5c w_89f6097
89770d7ec.jpg,w_3f7d5f5 new_whale w_1f7c696 w_0cbf1b3 w_cefd512
8995e32d7.jpg,w_396c12b w_ea6a9f4 new_whale w_3bb142c w_74c924a
899799da4.jpg,new_whale w_5597026 w_a88f2c1 w_e25b062 w_5a2634c
89b5ebe0a.jpg,w_825910b w_d0a7600 new_whale w_0bbc3cb w_2362d7f
89ba54ca3.jpg,w_f6c5343 w_252d315 new_whale w_6cda039 w_859dbc3
89c4afcc6.jpg,new_whale w_fd3e556 w_0ee7878 w_6cfa650 w_0b1e4a6
89d35cfb2.jpg,w_ec16cc4 new_whale w_6d8f72e w_1e286e0 w_4e01dd9
89da1b025.jpg,w_8ea9f68 new_whale w_c2c1e28 w_5ed2a38 w_4bf625b
89da38524.jpg,w_c0bf8f8 new_whale w_939423d w_a8b0ec1 w_13aa123
89df322f2.jpg,w_20950a9 w_fa8c44c new_whale w_fa2ec89 w_93fddcb
89f4f524c.jpg,new_whale w_9ba4a9a w_c3d896a w_597758e w_1006b9c
89f7e4833.jpg,new_whale w_e2c24d2 w_5d426b6 w_73d6671 w_4e63f7a
8a006b9df.jpg,w_5793f1c new_whale w_57abc0f w_5d426b6 w_e71f9c7
8a0ef6827.jpg,new_whale w_91b678a w_5e8e218 w_1d532b4 w_88eaa39
8a18b21df.jpg,w_27aa28c new_whale w_8ca7f37 w_dba1c08 w_86d0c34
8a27b9ea4.jpg,w_3eae264 new_whale w_20dfb69 w_6822dbc w_f3b2948
8a2efdaf1.jpg,w_7918564 new_whale w_53d3f73 w_89f6097 w_d066f46
8a3817eeb.jpg,new_whale w_89f6097 w_7d79c77 w_8d4c9f7 w_5c2c1a1
8a3fe1e7e.jpg,w_f953704 new_whale w_817d53c w_cf25b84 w_555dcb4
8a448bca0.jpg,w_68ed1f9 new_whale w_ad6a6ca w_653099f w_ea7bc89
8a4b5372a.jpg,w_6fe5b8e w_81d1ff9 new_whale w_8affab2 w_8a1786f
8a529c7b6.jpg,w_23a388d new_whale w_9ed5f69 w_be235cb w_bef0a5d
8a5663c27.jpg,w_025911c w_29e5e8e new_whale w_d6d89ed w_9ad3618
8a5e0df86.jpg,new_whale w_990921b w_ebdc496 w_88445b2 w_0887d9b
8a63e77b5.jpg,w_f1b6eea new_whale w_0a87ea4 w_9714922 w_34d7623
8a68e55e3.jpg,new_whale w_99ce0ec w_4274db3 w_54c535e w_1834b49
8a6fff4ff.jpg,w_6b2ecc8 new_whale w_03670aa w_700ebb4 w_5530579
8a71f923a.jpg,w_8fb247e new_whale w_bb086fc w_84714f4 w_a88c767
8a7cf5f8f.jpg,w_b210a87 new_whale w_15b5df2 w_1f0cf0a w_d055e5f
8a7fa76e9.jpg,w_f765256 new_whale w_25f1a4e w_1f1cee1 w_ad91d77
8a8104363.jpg,w_32da935 new_whale w_a63cd8d w_71b9a85 w_9094c50
8a85f90aa.jpg,w_8ca7f37 w_fd3e556 new_whale w_f86b16b w_611d18b
8a896e584.jpg,w_334c489 w_57aeea3 new_whale w_76065ea w_60f11fb
8a95eb8d4.jpg,w_dec3c84 new_whale w_f1b6eea w_c190aa8 w_04f5f55
8a9a77d95.jpg,w_3fe5d56 new_whale w_807f02e w_d1b3a00 w_e5ab551
8a9f34d2f.jpg,w_2aaa3b5 new_whale w_4a01f24 w_86d0c34 w_e4502b3
8a9f457cf.jpg,new_whale w_09de1a5 w_a6eaf8d w_6b25530 w_f971ecb
8aa118124.jpg,w_6c3ec2d new_whale w_6e0a45b w_13aa123 w_2b65b34
8ab31a146.jpg,w_fc83ab4 new_whale w_50fd107 w_d14059c w_e1c5b57
8ab65822c.jpg,w_32da935 new_whale w_6cec90c w_dd944b7 w_9ddb645
8ac2a6e50.jpg,w_f3b2948 w_fbcfe74 new_whale w_cac17d9 w_836e895
8ad20637d.jpg,w_5f5f9ae new_whale w_8c8f8b6 w_ea67beb w_c11f9d8
8ae279dbb.jpg,w_e13f4e8 w_4c62681 new_whale w_9ed5f69 w_20dfb69
8aecb52f0.jpg,w_d18083c new_whale w_0c76e03 w_ce72e73 w_bb56867
8aff1d902.jpg,w_5037cfd new_whale w_ae19ff0 w_13937e4 w_244e953
8b011ddbc.jpg,new_whale w_5116e7e w_ecd734e w_b38f64b w_7f04b8b
8b12f6c73.jpg,new_whale w_5101888 w_4ff2f4a w_aa0dacc w_581ba42
8b18358a2.jpg,w_953b7b2 new_whale w_003bae6 w_ab2ac77 w_4ff2f4a
8b207905d.jpg,new_whale w_662530e w_5d81be1 w_21591ba w_a33ed90
8b336846d.jpg,w_3de579a new_whale w_9c506f6 w_a9304b9 w_89f6097
8b3537365.jpg,w_72f3685 w_9032a74 new_whale w_8cee3d3 w_c058057
8b3ace4c8.jpg,w_35756a2 new_whale w_3b970db w_0f84e7c w_a589923
8b3bd4914.jpg,w_3dc1e42 new_whale w_6e97ef4 w_445a265 w_fb98d50
8b497d013.jpg,w_c6fe966 new_whale w_3002b59 w_c16cb2c w_1260eb5
8b533971f.jpg,w_58d3dd3 new_whale w_0bf90d9 w_6caff0f w_a0f456b
8b5bddc4e.jpg,w_51c003e new_whale w_1104cca w_069c25b w_47996c6
8b5fb6cb4.jpg,new_whale w_5597026 w_37bc202 w_62c78f3 w_3879fa0
8b60216ee.jpg,w_84b255f new_whale w_1932830 w_5778858 w_fa4034b
8b611aba2.jpg,w_9af8493 new_whale w_003bae6 w_a79a828 w_6684eea
8b64cf1da.jpg,new_whale w_3cb4838 w_06d2e72 w_0abdaf4 w_bf41c21
8b6714dd4.jpg,w_f381082 w_1d9592f new_whale w_4f8332a w_44479bb
8b78540b1.jpg,w_2694603 new_whale w_22d96e7 w_59f2171 w_0bc1de9
8bad77a8d.jpg,new_whale w_b9d5945 w_4562f42 w_8cee3d3 w_a9822dd
8bccce4a5.jpg,w_ab7c369 w_3879fa0 new_whale w_60ce6fc w_b938e96
8bce617fc.jpg,w_c4862bb new_whale w_361a865 w_ac33bfe w_79843ce
8bd2b988d.jpg,new_whale w_d066f46 w_2d7c2dd w_2fec5ea w_85923bb
8bd57029b.jpg,w_b21cfe4 new_whale w_4c206e7 w_a8c2847 w_2b39f31
8bdf57430.jpg,w_cdc4a40 new_whale w_c190aa8 w_872f131 w_4d06559
8be3c7848.jpg,w_1b2bf0f w_659bdb8 new_whale w_21b2790 w_20950a9
8be579400.jpg,new_whale w_27fa393 w_0a87ea4 w_789c969 w_51c003e
8be681b07.jpg,w_3002b59 w_80f481f new_whale w_e8ab3c8 w_f61b957
8bee357c0.jpg,w_fd3e556 w_836e895 new_whale w_ec7e60a w_f05a1df
8bf4c89c0.jpg,w_96985c1 new_whale w_09c8a69 w_5083a58 w_bb2c919
8c10e784e.jpg,w_e2c24d2 new_whale w_60f11fb w_ac2c28e w_24c76d8
8c117bedf.jpg,w_5077be0 w_7d6527e new_whale w_f3a12bc w_b9c99cc
8c160195d.jpg,w_68eaf36 new_whale w_fbfe96b w_59915b1 w_c6fe966
8c26a80f0.jpg,w_4eb6bcc new_whale w_c566a3d w_33eb301 w_4d61be5
8c2893f03.jpg,w_60122fa new_whale w_b495218 w_270f505 w_84dadae
8c28efa79.jpg,w_39f3e3a new_whale w_9d86594 w_8003858 w_da011a1
8c2bd28a2.jpg,w_242fb46 w_7a61cb2 new_whale w_fd14088 w_8a1786f
8c44472b4.jpg,w_8fb247e new_whale w_711552b w_37bc202 w_6afdf63
8c49824a6.jpg,w_21b2790 new_whale w_a79a828 w_b8a7ee7 w_f437f82
8c4d9e49c.jpg,w_37d2f3a new_whale w_5793f1c w_a88c767 w_00b3dc2
8c5571d2b.jpg,new_whale w_68fc65d w_6cb1ff1 w_23ce00e w_d588fb4
8c6d0f013.jpg,w_700ebb4 w_36fdacd w_9d29561 new_whale w_009c9c5
8c6d90579.jpg,w_21b2790 new_whale w_b938e96 w_e27bbf6 w_cf1551f
8c7c2f4a9.jpg,w_07768b0 new_whale w_a88f2c1 w_3c972b3 w_124a3cb
8c82ba1d5.jpg,w_47d86e8 new_whale w_fbcfe74 w_1faaf06 w_99e43ae
8c928d697.jpg,new_whale w_6e7cf1c w_11e90bc w_2f5caa9 w_b9d732d
8c92c78c8.jpg,w_f5bf6df new_whale w_13937e4 w_83cc0ec w_0d052c1
8cab4875a.jpg,w_20c0bc0 w_0baf946 new_whale w_1f7c696 w_5cc8711
8cba4a867.jpg,new_whale w_f5bf6df w_d0b330d w_c262606 w_71d5ba2
8cc48ab02.jpg,w_26ba5fd new_whale w_9f13096 w_b6ad668 w_da5b8fe
8cd8d759c.jpg,new_whale w_8d52508 w_5b8805a w_cb50f6e w_dfe2ab5
8cda71a2c.jpg,w_b1461a9 new_whale w_8261f4d w_2972f31 w_4441671
8ce02a30a.jpg,w_3a63e33 new_whale w_5ed2a38 w_274f6db w_9e020d1
8ceb7e5fc.jpg,new_whale w_e2c24d2 w_40be8d6 w_bc285a6 w_90336d0
8cf0fd984.jpg,w_a8276b4 new_whale w_3de579a w_c2a1bc4 w_f7cb97d
8cf40ebb5.jpg,w_ac26398 new_whale w_22d96e7 w_17b0d3a w_98f2705
8cf8e65d6.jpg,new_whale w_1930599 w_71df35a w_e897a60 w_e1f57e7
8d10b98c1.jpg,new_whale w_eba33fb w_f765256 w_d71a790 w_b8a7ee7
8d2a42bfd.jpg,w_0369a5c new_whale w_a283c8c w_2d6596f w_789c969
8d3a575f5.jpg,w_2645f4d w_5bf792a new_whale w_470be90 w_5793f1c
8d4bb8274.jpg,new_whale w_653099f w_3d972c9 w_a26cf66 w_b9e5911
8d4c07b77.jpg,w_d16eb60 new_whale w_c11f9d8 w_3ec7fa2 w_da40b39
8d4cde07e.jpg,w_b9d5945 new_whale w_08630fd w_8a1786f w_ab7c369
8d52d9970.jpg,new_whale w_05b4b0c w_decafbd w_5f5f9ae w_bfcad53
8d5b48c67.jpg,new_whale w_8c56684 w_d15d8c5 w_d2c2be0 w_3729146
8d5f4b638.jpg,w_a2a40d2 new_whale w_dd80742 w_1ccd2a1 w_aaf3463
8d5ff7f81.jpg,w_cd2d796 w_a9304b9 new_whale w_0189b6d w_7085ad6
8d626a232.jpg,new_whale w_2964e0b w_e1ffbe2 w_445cc76 w_5ff2049
8d64a3f56.jpg,w_9b25161 w_16b7fec new_whale w_dcbdd01 w_3b03149
8d67d696d.jpg,w_8ad2534 new_whale w_2cabd62 w_fa11a3f w_9109577
8d77e91be.jpg,w_08630fd new_whale w_8b86b95 w_0b398b2 w_3eae264
8d7b8e1e5.jpg,w_454f511 new_whale w_81d1ff9 w_191bce3 w_c073f96
8d8c7a728.jpg,new_whale w_a335fc2 w_f765256 w_2f8de4f w_71fbd51
8d972a6b5.jpg,w_8fb247e w_465d9c7 w_ae19ff0 new_whale w_5cc8711
8da08a11a.jpg,w_c11f9d8 new_whale w_d0bfef3 w_939a97b w_19f507e
8da0f8225.jpg,w_3f21fed new_whale w_be4f189 w_564a34b w_1029215
8da6ddac9.jpg,new_whale w_ea902fb w_e818b1a w_f3b2948 w_9b3076d
8da7fe24e.jpg,w_6ca173f new_whale w_343f088 w_1472271 w_0887d9b
8db62d009.jpg,w_9eb2d2a new_whale w_dcbdd01 w_5cc8711 w_88aca21
8dbbfbb12.jpg,w_aaf3463 new_whale w_a2a40d2 w_da40b39 w_cf9055c
8dbdc772c.jpg,w_0f466a5 new_whale w_c1715f5 w_d066f46 w_e71f9c7
8dbf76c6a.jpg,w_8cfabed new_whale w_1788910 w_72f3685 w_59d1835
8dc0dba17.jpg,w_939423d w_bd1c3d5 new_whale w_f765256 w_23e1d57
8dc50d85e.jpg,w_d0bfef3 new_whale w_c0e27e9 w_8a6a8d5 w_02e8199
8dc647177.jpg,w_9aa9809 new_whale w_e2a09d4 w_ad672ce w_a1a0090
8dee60104.jpg,w_ed1df50 new_whale w_4e63f7a w_cdc4a40 w_9aacaa0
8df20308d.jpg,w_68eaf36 new_whale w_9fc06d4 w_6d43e1d w_0749e87
8dfd1382e.jpg,w_1ea5d96 new_whale w_c27ee06 w_3a192ed w_d8cb231
8e0176731.jpg,w_5665c80 w_787af6b new_whale w_4e88955 w_8507818
8e08208ee.jpg,w_ea902fb new_whale w_98f2705 w_8431ae8 w_b7b0ad7
8e09a790d.jpg,w_b7b0ad7 new_whale w_5793f1c w_2b50adf w_0b1e4a6
8e09ea52a.jpg,w_7d458aa w_2059146 new_whale w_6071978 w_13c8177
8e0a9e74b.jpg,w_84dadae new_whale w_b26e855 w_df4b60a w_11bd416
8e0f2b2e1.jpg,w_14330a0 new_whale w_1b5fd1b w_7547b9a w_066ddc5
8e10aac2d.jpg,w_a059841 w_59088ff new_whale w_7d6527e w_6cda039
8e19aeede.jpg,w_8a6a8d5 new_whale w_34afc43 w_b3cde16 w_b3afb40
8e1d39e97.jpg,w_877de07 new_whale w_27be996 w_729290b w_ab41d9b
8e2226b90.jpg,w_fa4034b new_whale w_df1f698 w_c6a96e1 w_2f1488c
8e240eca2.jpg,w_d3e3b56 new_whale w_2694603 w_22d96e7 w_396c12b
8e26be8e9.jpg,w_2cabd62 new_whale w_470be90 w_1b5b199 w_88adb3a
8e2882d8d.jpg,w_f3d2e31 new_whale w_264c2e1 w_396c12b w_3bb142c
8e2a9088d.jpg,new_whale w_bdb3a05 w_bbfce38 w_0b398b2 w_efa100e
8e340102f.jpg,w_23a388d new_whale w_0e9f07a w_faf5287 w_3f6f934
8e45ff5f9.jpg,w_cd4cb49 new_whale w_9b5109b w_700ebb4 w_0369a5c
8e4d60a56.jpg,new_whale w_4516ff1 w_52cd115 w_0027efa w_4a8a4c9
8e65249c1.jpg,w_b4fe6b0 new_whale w_0d43823 w_9ddb645 w_0833a92
8e786c1e8.jpg,w_565d73a new_whale w_29d806a w_c2397a4 w_261878d
8e7a49fe5.jpg,new_whale w_186d294 w_63f5740 w_16df050 w_14ece76
8e89afc70.jpg,new_whale w_fbc7895 w_540ac0a w_c1efffb w_9739508
8e8b1e733.jpg,new_whale w_3b71107 w_74f384b w_29af733 w_b037216
8e8f1986a.jpg,w_f66ec54 new_whale w_b950c88 w_22f2567 w_72c56cc
8e9ed1132.jpg,w_9ba4a9a new_whale w_9b9602c w_f39c242 w_6c995fd
8ea848e25.jpg,w_861e504 new_whale w_551f361 w_ec16cc4 w_729290b
8ea966b05.jpg,new_whale w_2d5b0e1 w_ab7c369 w_2a98962 w_5a49beb
8eaca309b.jpg,new_whale w_8be8406 w_d49d4d7 w_4c62681 w_bd572cf
8eb4cc215.jpg,new_whale w_953b7b2 w_b1a3345 w_6658081 w_470be90
8ebfecd3d.jpg,w_fa955f1 w_79843ce new_whale w_6579856 w_4690940
8ec773031.jpg,w_b07ec5d new_whale w_b805777 w_dced3f2 w_8be0240
8ecb4b78b.jpg,w_8e3a722 new_whale w_5258623 w_67153b4 w_75648fc
8ed10b79f.jpg,w_3384715 new_whale w_4182dba w_c058057 w_93fcf89
8eeb76c7d.jpg,w_dc27ce9 new_whale w_0a7a37c w_955bfe2 w_353d249
8ef3b3fb1.jpg,new_whale w_7d02551 w_6822dbc w_20dfb69 w_41429ea
8efd67d1e.jpg,new_whale w_b2bc0c9 w_234d686 w_f765256 w_3bf887a
8f12dffcf.jpg,w_9748a78 new_whale w_f5bf6df w_0cfdaa5 w_6aab519
8f14df8c6.jpg,w_2a7f00f new_whale w_6dbfd7a w_c1b34d2 w_e1c5b57
8f1b66a46.jpg,new_whale w_8c56684 w_7ff9682 w_08d62ee w_bd26110
8f1cd04dd.jpg,w_4274db3 new_whale w_8beb9f1 w_3c880c2 w_fae4be5
